number,value,state,datetime_start,datetime_complete,duration,params_activation,params_batch_size,params_dim_feedforward,params_dropout,params_lr,params_model_dim,params_momentum_sgd,params_norm,params_norm_type,params_num_heads,params_num_layers,params_optimizer,params_pooling,params_pos_encoding,params_weight_decay
0,0.21759048895761182,COMPLETE,2025-11-05 02:16:52.388321,2025-11-05 02:18:33.666304,0 days 00:01:41.277983,elu,16,768,0.30000000000000004,2e-05,768,0.9,minmax,postnorm,2,4,SGD,cls,sinusoidal,1e-07
1,0.2667735303799639,COMPLETE,2025-11-05 02:18:33.668304,2025-11-05 02:18:45.083312,0 days 00:00:11.415008,gelu,96,384,0.4,0.0005,256,,L2,postnorm,2,1,AdamW,max,learned,1e-07
2,0.22288520556564687,COMPLETE,2025-11-05 02:18:45.084328,2025-11-05 02:19:10.855450,0 days 00:00:25.771122,gelu,64,768,0.2,1e-05,768,,L2,postnorm,8,2,Adam,max,sinusoidal,1e-06
3,0.21759048895761182,COMPLETE,2025-11-05 02:19:10.856458,2025-11-05 02:19:47.603851,0 days 00:00:36.747393,hardswish,16,384,0.0,0.0001,128,,L2,prenorm,16,1,AdamW,cls,sinusoidal,1e-06
4,0.21759048895761182,COMPLETE,2025-11-05 02:19:47.605852,2025-11-05 02:21:16.918848,0 days 00:01:29.312996,relu,16,512,0.0,2e-05,256,,minmax,prenorm,4,4,RMSprop,cls,learned,1e-07
5,0.21759048895761182,COMPLETE,2025-11-05 02:21:16.919848,2025-11-05 02:21:42.506551,0 days 00:00:25.586703,elu,64,384,0.2,5e-05,256,0.5,minmax,prenorm,16,3,SGD,mean,learned,0.0
6,0.178030303030303,PRUNED,2025-11-05 02:21:42.508974,2025-11-05 02:21:52.101317,0 days 00:00:09.592343,prelu,64,512,0.0,0.0005,384,,minmax,postnorm,4,1,RMSprop,mean,sinusoidal,1e-05
7,0.2533574759660476,COMPLETE,2025-11-05 02:21:52.102317,2025-11-05 02:22:05.221339,0 days 00:00:13.119022,prelu,96,512,0.1,1e-05,768,,minmax,postnorm,8,1,RMSprop,max,learned,1e-06
8,0.0894854586129754,PRUNED,2025-11-05 02:22:05.223342,2025-11-05 02:22:15.723529,0 days 00:00:10.500187,hardswish,96,384,0.30000000000000004,0.001,384,,L2,prenorm,16,2,Adam,cls,sinusoidal,1e-06
9,0.178030303030303,PRUNED,2025-11-05 02:22:15.724547,2025-11-05 02:22:27.702425,0 days 00:00:11.977878,relu,96,256,0.4,1e-05,256,,L2,prenorm,2,3,AdamW,cls,sinusoidal,1e-05
10,0.08558558558558559,PRUNED,2025-11-05 02:22:27.703426,2025-11-05 02:22:39.297014,0 days 00:00:11.593588,gelu,32,256,0.4,0.0005,512,,L2,postnorm,2,2,AdamW,max,learned,1e-07
11,0.17702448210922786,PRUNED,2025-11-05 02:22:39.298015,2025-11-05 02:22:42.161100,0 days 00:00:02.863085,prelu,128,512,0.1,0.0002,768,,minmax,postnorm,8,1,RMSprop,max,learned,0.0
12,0.40211780869885677,COMPLETE,2025-11-05 02:22:42.161100,2025-11-05 02:22:59.065323,0 days 00:00:16.904223,silu,96,384,0.1,0.0005,512,,minmax,postnorm,8,1,AdamW,max,learned,1e-06
13,0.21761658031088082,PRUNED,2025-11-05 02:22:59.067344,2025-11-05 02:23:03.685044,0 days 00:00:04.617700,silu,96,384,0.1,0.0005,512,,L2,postnorm,2,1,AdamW,max,learned,1e-07
14,0.21759048895761182,COMPLETE,2025-11-05 02:23:03.686062,2025-11-05 02:23:18.628865,0 days 00:00:14.942803,silu,96,384,0.30000000000000004,0.0005,512,,minmax,postnorm,8,2,AdamW,max,learned,1e-06
15,0.178030303030303,PRUNED,2025-11-05 02:23:18.630879,2025-11-05 02:23:26.599870,0 days 00:00:07.968991,leakyrelu,128,384,0.2,0.0005,128,,L2,postnorm,2,1,AdamW,max,learned,1e-07
16,0.21759048895761182,COMPLETE,2025-11-05 02:23:26.600870,2025-11-05 02:24:07.854198,0 days 00:00:41.253328,mish,32,384,0.4,0.0002,256,,L2,postnorm,8,3,AdamW,mean,learned,1e-05
17,0.25988407194804203,COMPLETE,2025-11-05 02:24:07.856199,2025-11-05 02:24:27.000661,0 days 00:00:19.144462,gelu,96,384,0.1,5e-05,512,,minmax,postnorm,4,2,AdamW,max,learned,0.0
18,0.21759048895761182,COMPLETE,2025-11-05 02:24:27.001669,2025-11-05 02:24:37.368368,0 days 00:00:10.366699,silu,96,768,0.30000000000000004,0.0001,256,0.0,minmax,postnorm,2,1,SGD,max,learned,1e-06
19,0.178030303030303,PRUNED,2025-11-05 02:24:37.370892,2025-11-05 02:24:42.909198,0 days 00:00:05.538306,leakyrelu,96,256,0.1,0.001,512,,L2,postnorm,8,2,Adam,max,learned,1e-07
20,0.21759048895761182,COMPLETE,2025-11-05 02:24:42.911198,2025-11-05 02:24:53.454954,0 days 00:00:10.543756,gelu,128,384,0.2,0.0005,384,,minmax,postnorm,2,1,AdamW,mean,learned,1e-07
21,0.302219492019548,COMPLETE,2025-11-05 02:24:53.456966,2025-11-05 02:25:12.430854,0 days 00:00:18.973888,gelu,96,384,0.1,5e-05,512,,minmax,postnorm,4,2,AdamW,max,learned,0.0
22,0.178030303030303,PRUNED,2025-11-05 02:25:12.433358,2025-11-05 02:25:17.838751,0 days 00:00:05.405393,gelu,96,384,0.1,5e-05,512,,minmax,postnorm,4,2,AdamW,max,learned,0.0
23,0.178030303030303,PRUNED,2025-11-05 02:25:17.839755,2025-11-05 02:25:25.295143,0 days 00:00:07.455388,mish,96,384,0.0,5e-05,512,,minmax,postnorm,4,1,AdamW,max,learned,0.0
24,0.21759048895761182,COMPLETE,2025-11-05 02:25:25.296144,2025-11-05 02:26:08.440670,0 days 00:00:43.144526,silu,32,384,0.2,0.0005,512,,minmax,postnorm,4,3,AdamW,max,learned,0.0
25,0.21759048895761182,COMPLETE,2025-11-05 02:26:08.442669,2025-11-05 02:26:22.553424,0 days 00:00:14.110755,gelu,96,384,0.1,5e-05,128,,minmax,postnorm,4,2,AdamW,max,learned,0.0
26,0.21761658031088082,PRUNED,2025-11-05 02:26:22.555452,2025-11-05 02:26:27.121816,0 days 00:00:04.566364,gelu,96,384,0.2,0.0005,256,,L2,prenorm,8,1,AdamW,max,learned,1e-06
27,0.21759048895761182,COMPLETE,2025-11-05 02:26:27.121816,2025-11-05 02:26:38.380306,0 days 00:00:11.258490,silu,96,256,0.0,2e-05,512,,minmax,postnorm,16,1,Adam,max,learned,1e-05
28,0.21759048895761182,COMPLETE,2025-11-05 02:26:38.381306,2025-11-05 02:26:52.599850,0 days 00:00:14.218544,gelu,96,768,0.1,0.0002,512,0.0,L2,postnorm,2,2,SGD,mean,learned,1e-06
29,0.21759048895761182,COMPLETE,2025-11-05 02:26:52.600850,2025-11-05 02:28:04.393002,0 days 00:01:11.792152,elu,16,384,0.30000000000000004,0.001,256,0.9,minmax,postnorm,8,3,SGD,max,sinusoidal,1e-07
30,0.21759048895761182,COMPLETE,2025-11-05 02:28:04.394525,2025-11-05 02:28:57.715370,0 days 00:00:53.320845,hardswish,32,768,0.4,0.0001,384,,minmax,postnorm,4,4,AdamW,cls,learned,0.0
31,0.36428694291773905,COMPLETE,2025-11-05 02:28:57.717474,2025-11-05 02:29:17.202314,0 days 00:00:19.484840,gelu,96,384,0.1,5e-05,512,,minmax,postnorm,4,2,AdamW,max,learned,0.0
32,0.21761658031088082,PRUNED,2025-11-05 02:29:17.203818,2025-11-05 02:29:23.473911,0 days 00:00:06.270093,gelu,96,384,0.1,5e-05,512,,minmax,postnorm,4,2,AdamW,max,learned,0.0
33,0.33446788273967143,COMPLETE,2025-11-05 02:29:23.474414,2025-11-05 02:29:58.674998,0 days 00:00:35.200584,gelu,64,384,0.2,5e-05,512,,minmax,postnorm,4,2,AdamW,max,learned,0.0
34,0.3555847822482609,COMPLETE,2025-11-05 02:29:58.677421,2025-11-05 02:30:24.298371,0 days 00:00:25.620950,gelu,64,384,0.2,5e-05,512,,minmax,postnorm,4,2,AdamW,max,learned,0.0
35,0.22204510837659763,COMPLETE,2025-11-05 02:30:24.300372,2025-11-05 02:30:53.812110,0 days 00:00:29.511738,relu,64,384,0.2,5e-05,512,,minmax,postnorm,4,3,AdamW,max,sinusoidal,0.0
36,0.24762314780269637,COMPLETE,2025-11-05 02:30:53.813614,2025-11-05 02:31:16.918886,0 days 00:00:23.105272,gelu,64,384,0.2,5e-05,512,,minmax,prenorm,4,2,AdamW,max,learned,0.0
37,0.21759048895761182,COMPLETE,2025-11-05 02:31:16.920886,2025-11-05 02:31:41.055254,0 days 00:00:24.134368,elu,64,768,0.2,2e-05,768,,minmax,postnorm,4,2,Adam,cls,learned,0.0
38,0.247965247519675,COMPLETE,2025-11-05 02:31:41.057382,2025-11-05 02:32:09.974844,0 days 00:00:28.917462,mish,64,512,0.30000000000000004,5e-05,128,,minmax,prenorm,4,3,RMSprop,max,sinusoidal,0.0
39,0.21761658031088082,PRUNED,2025-11-05 02:32:09.976846,2025-11-05 02:32:24.413907,0 days 00:00:14.437061,gelu,64,384,0.0,5e-05,512,,minmax,postnorm,16,4,AdamW,mean,learned,1e-06
40,0.3182863155247189,COMPLETE,2025-11-05 02:32:24.414411,2025-11-05 02:32:49.329219,0 days 00:00:24.914808,leakyrelu,64,384,0.2,1e-05,512,,minmax,postnorm,4,2,RMSprop,max,learned,0.0
41,0.17702448210922786,PRUNED,2025-11-05 02:32:49.331220,2025-11-05 02:32:53.859025,0 days 00:00:04.527805,leakyrelu,64,384,0.2,1e-05,512,,minmax,postnorm,4,2,RMSprop,max,learned,0.0
42,0.33402353585865613,COMPLETE,2025-11-05 02:32:53.860029,2025-11-05 02:33:24.536109,0 days 00:00:30.676080,leakyrelu,64,384,0.2,1e-05,512,,minmax,postnorm,4,2,RMSprop,max,learned,0.0
43,0.0894854586129754,PRUNED,2025-11-05 02:33:24.538109,2025-11-05 02:33:40.189935,0 days 00:00:15.651826,leakyrelu,64,384,0.2,1e-05,512,,minmax,postnorm,4,2,RMSprop,max,learned,0.0
44,0.24820181200416805,COMPLETE,2025-11-05 02:33:40.190935,2025-11-05 02:34:37.901220,0 days 00:00:57.710285,hardswish,16,512,0.2,1e-05,512,,minmax,postnorm,4,2,RMSprop,cls,learned,0.0
45,0.08558558558558559,PRUNED,2025-11-05 02:34:37.902229,2025-11-05 02:34:46.310867,0 days 00:00:08.408638,prelu,64,384,0.30000000000000004,5e-05,768,0.4,minmax,prenorm,8,2,SGD,max,sinusoidal,1e-06
46,0.178030303030303,PRUNED,2025-11-05 02:34:46.311867,2025-11-05 02:35:05.529773,0 days 00:00:19.217906,relu,64,256,0.1,0.0001,512,,minmax,postnorm,16,3,RMSprop,max,learned,1e-05
47,0.10005668934240364,PRUNED,2025-11-05 02:35:05.529773,2025-11-05 02:35:12.852626,0 days 00:00:07.322853,silu,64,384,0.2,2e-05,384,,minmax,postnorm,4,2,AdamW,max,learned,0.0
48,0.0894854586129754,PRUNED,2025-11-05 02:35:12.854128,2025-11-05 02:35:38.662167,0 days 00:00:25.808039,leakyrelu,16,384,0.1,1e-05,512,,minmax,postnorm,8,1,AdamW,max,learned,1e-06
49,0.178030303030303,PRUNED,2025-11-05 02:35:38.663168,2025-11-05 02:35:46.498503,0 days 00:00:07.835335,gelu,128,512,0.2,5e-05,128,,minmax,prenorm,4,1,Adam,cls,sinusoidal,0.0
