number,value,datetime_start,datetime_complete,duration,params_activation,params_base_dim,params_batch_size,params_do_layer,params_dropout_rate,params_lr,params_n_layers,params_norm,params_norm_layer,params_pca_frac,params_pooling,params_use_pca,params_wd,user_attrs_final_train_loss,state,final_train_loss
0,0.3091,2025-08-14 18:04:44.773402,2025-08-14 18:05:15.107218,0 days 00:00:30.333816,elu,512,16,0,0.2,1e-05,1,minmax,0,0.7,max,True,1e-05,0.9357542098526787,COMPLETE,0.9357542098526787
1,0.3252,2025-08-14 18:05:15.108218,2025-08-14 18:05:25.214821,0 days 00:00:10.106603,tanh,512,64,1,0.5,0.0001,1,minmax,0,0.85,max,True,1e-05,0.8287128112323798,COMPLETE,0.8287128112323798
2,0.3235,2025-08-14 18:05:25.215820,2025-08-14 18:05:37.803966,0 days 00:00:12.588146,relu,512,64,2,0.3,0.001,3,L2,3,0.8,max,True,0.0001,0.03272008253830422,COMPLETE,0.03272008253830422
3,0.3687,2025-08-14 18:05:37.804967,2025-08-14 18:05:45.158242,0 days 00:00:07.353275,elu,512,128,0,0.1,0.001,1,minmax,1,,mean,False,1e-06,0.009784077728388777,COMPLETE,0.009784077728388777
4,0.3791,2025-08-14 18:05:45.159243,2025-08-14 18:05:55.609165,0 days 00:00:10.449922,gelu,128,64,1,0.2,0.001,1,L2,1,0.9,mean,True,0.0,0.004293475347987325,COMPLETE,0.004293475347987325
5,0.2484,2025-08-14 18:05:55.610166,2025-08-14 18:06:38.337922,0 days 00:00:42.727756,relu,128,16,2,0.4,1e-05,3,minmax,1,0.85,mean,True,0.0001,0.9359748649060534,COMPLETE,0.9359748649060534
6,0.3667,2025-08-14 18:06:38.338922,2025-08-14 18:06:50.788320,0 days 00:00:12.449398,tanh,512,64,3,0.1,0.0001,3,minmax,1,0.8,mean,True,0.0,0.011908805632658327,COMPLETE,0.011908805632658327
7,0.3483,2025-08-14 18:06:50.789320,2025-08-14 18:07:29.370909,0 days 00:00:38.581589,elu,128,16,1,0.2,0.0001,2,minmax,2,0.8,max,True,0.0001,0.608798300338328,COMPLETE,0.608798300338328
8,0.3391,2025-08-14 18:07:29.371908,2025-08-14 18:07:39.137094,0 days 00:00:09.765186,gelu,128,64,0,0.3,0.0001,1,minmax,0,0.95,mean,True,1e-06,0.7548525275908099,COMPLETE,0.7548525275908099
9,0.2176,2025-08-14 18:07:39.138094,2025-08-14 18:07:48.693508,0 days 00:00:09.555414,elu,128,64,0,0.2,0.0001,1,L2,0,,mean,False,0.0001,0.9988379999755663,COMPLETE,0.9988379999755663
10,0.3102,2025-08-14 18:07:48.694508,2025-08-14 18:08:08.857620,0 days 00:00:20.163112,gelu,256,32,1,0.4,0.001,2,L2,2,,mean,False,0.0,0.6923280308484264,COMPLETE,0.6923280308484264
11,0.3213,2025-08-14 18:08:08.858621,2025-08-14 18:08:16.956868,0 days 00:00:08.098247,leakyrelu,256,128,0,0.1,0.001,2,L2,1,,mean,False,1e-06,0.5523677050492388,COMPLETE,0.5523677050492388
12,0.3303,2025-08-14 18:08:16.957868,2025-08-14 18:08:24.268009,0 days 00:00:07.310141,gelu,128,128,0,0.1,0.001,1,L2,1,,mean,False,1e-06,0.3689207585103259,COMPLETE,0.3689207585103259
13,0.2751,2025-08-14 18:08:24.269009,2025-08-14 18:08:31.750191,0 days 00:00:07.481182,leakyrelu,512,128,1,0.5,0.001,1,L2,1,,mean,False,0.0,0.8520668904114382,COMPLETE,0.8520668904114382
14,0.3273,2025-08-14 18:08:31.752191,2025-08-14 18:08:52.330291,0 days 00:00:20.578100,gelu,256,32,2,0.1,0.001,2,minmax,2,,mean,False,1e-06,0.0013867819320913584,COMPLETE,0.0013867819320913584
15,0.311,2025-08-14 18:08:52.331292,2025-08-14 18:08:59.627480,0 days 00:00:07.296188,elu,512,128,0,0.2,0.001,1,L2,1,,mean,False,0.0,0.7580876691548387,COMPLETE,0.7580876691548387
16,0.3312,2025-08-14 18:08:59.628480,2025-08-14 18:09:07.913844,0 days 00:00:08.285364,gelu,128,128,1,0.1,1e-05,2,minmax,2,0.9,mean,True,1e-06,0.9317149236271236,COMPLETE,0.9317149236271236
17,0.3224,2025-08-14 18:09:07.914843,2025-08-14 18:09:18.103924,0 days 00:00:10.189081,elu,128,64,0,0.2,0.001,1,L2,1,,mean,False,0.0,0.5788106081761731,COMPLETE,0.5788106081761731
18,0.3367,2025-08-14 18:09:18.104924,2025-08-14 18:09:35.889969,0 days 00:00:17.785045,tanh,512,32,0,0.3,0.001,1,L2,1,,max,False,1e-05,0.7842195009111975,COMPLETE,0.7842195009111975
19,0.3525,2025-08-14 18:09:35.890968,2025-08-14 18:09:43.632177,0 days 00:00:07.741209,leakyrelu,256,128,2,0.4,0.001,2,minmax,0,0.75,mean,True,0.0,0.009288544901362186,COMPLETE,0.009288544901362186
20,0.2176,2025-08-14 18:09:43.633177,2025-08-14 18:09:54.056294,0 days 00:00:10.423117,relu,128,64,0,0.5,1e-05,1,L2,1,0.9,mean,True,1e-06,1.0002644188534409,COMPLETE,1.0002644188534409
21,0.3711,2025-08-14 18:09:54.057293,2025-08-14 18:10:06.409974,0 days 00:00:12.352681,tanh,512,64,3,0.1,0.0001,3,minmax,3,0.8,mean,True,0.0,0.31509951437401235,COMPLETE,0.31509951437401235
22,0.3803,2025-08-14 18:10:06.410974,2025-08-14 18:10:18.946172,0 days 00:00:12.535198,tanh,512,64,3,0.1,0.0001,3,minmax,3,0.9,mean,True,0.0,0.15574485561855353,COMPLETE,0.15574485561855353
23,0.3887,2025-08-14 18:10:18.947172,2025-08-14 18:10:31.428992,0 days 00:00:12.481820,tanh,512,64,3,0.1,0.0001,3,minmax,3,0.9,mean,True,0.0,0.15764193945950633,COMPLETE,0.15764193945950633
24,0.3779,2025-08-14 18:10:31.429992,2025-08-14 18:10:43.836279,0 days 00:00:12.406287,tanh,512,64,3,0.1,0.0001,3,minmax,3,0.9,mean,True,0.0,0.14910219020398865,COMPLETE,0.14910219020398865
25,0.3795,2025-08-14 18:10:43.838279,2025-08-14 18:10:56.338846,0 days 00:00:12.500567,tanh,512,64,3,0.2,0.0001,3,minmax,3,0.9,mean,True,0.0,0.19086631317997285,COMPLETE,0.19086631317997285
26,0.3554,2025-08-14 18:10:56.339846,2025-08-14 18:11:08.879471,0 days 00:00:12.539625,tanh,512,64,3,0.1,0.0001,3,minmax,3,0.9,max,True,0.0,0.13834067388554477,COMPLETE,0.13834067388554477
27,0.3939,2025-08-14 18:11:08.880471,2025-08-14 18:11:21.390133,0 days 00:00:12.509662,tanh,512,64,3,0.1,0.0001,3,minmax,3,0.9,mean,True,0.0,0.15607258711022196,COMPLETE,0.15607258711022196
28,0.386,2025-08-14 18:11:21.391132,2025-08-14 18:11:33.751814,0 days 00:00:12.360682,tanh,512,64,3,0.1,0.0001,3,minmax,3,0.9,mean,True,0.0,0.15760014409804268,COMPLETE,0.15760014409804268
29,0.3467,2025-08-14 18:11:33.752813,2025-08-14 18:12:15.993073,0 days 00:00:42.240260,tanh,512,16,3,0.1,0.0001,3,minmax,3,0.95,max,True,1e-05,0.01511143167709806,COMPLETE,0.01511143167709806
