number,value,datetime_start,datetime_complete,duration,params_activation,params_base_dim,params_batch_size,params_do_layer,params_dropout_rate,params_lr,params_n_layers,params_norm,params_norm_layer,params_pca_frac,params_pooling,params_use_pca,params_wd,user_attrs_final_train_loss,state,final_train_loss
0,0.3633,2025-08-14 17:29:24.046198,2025-08-14 17:29:36.568577,0 days 00:00:12.522379,leakyrelu,256,64,0,0.3,0.0001,3,minmax,1,0.7,mean,True,1e-06,0.10083393086574469,COMPLETE,0.10083393086574469
1,0.3625,2025-08-14 17:29:36.568577,2025-08-14 17:29:56.877148,0 days 00:00:20.308571,elu,512,32,0,0.2,0.001,2,L2,2,,mean,False,0.0001,0.0009175549026195355,COMPLETE,0.0009175549026195355
2,0.3619,2025-08-14 17:29:56.878146,2025-08-14 17:30:17.964241,0 days 00:00:21.086095,relu,256,32,2,0.5,0.001,3,L2,0,,mean,False,0.0,0.0003434518970303175,COMPLETE,0.0003434518970303175
3,0.2176,2025-08-14 17:30:17.965241,2025-08-14 17:30:40.094362,0 days 00:00:22.129121,leakyrelu,256,32,0,0.2,1e-05,3,L2,3,0.95,max,True,0.0001,0.9844065908450406,COMPLETE,0.9844065908450406
4,0.3232,2025-08-14 17:30:40.095362,2025-08-14 17:31:18.778319,0 days 00:00:38.682957,tanh,128,16,2,0.2,0.0001,2,minmax,1,,max,False,1e-06,0.02199092594804871,COMPLETE,0.02199092594804871
5,0.2774,2025-08-14 17:31:18.779319,2025-08-14 17:31:37.063638,0 days 00:00:18.284319,elu,512,32,1,0.5,0.001,1,L2,1,,max,False,0.0001,0.7305869015466745,COMPLETE,0.7305869015466745
6,0.318,2025-08-14 17:31:37.064483,2025-08-14 17:31:45.360951,0 days 00:00:08.296468,gelu,256,128,2,0.3,0.0001,2,minmax,2,,max,False,1e-05,0.1923325098691646,COMPLETE,0.1923325098691646
7,0.3786,2025-08-14 17:31:45.360951,2025-08-14 17:32:25.744765,0 days 00:00:40.383814,relu,128,16,0,0.2,0.0001,3,minmax,3,,mean,False,0.0,0.011808955107614925,COMPLETE,0.011808955107614925
8,0.2193,2025-08-14 17:32:25.745671,2025-08-14 17:32:34.789450,0 days 00:00:09.043779,relu,128,128,3,0.5,1e-05,3,minmax,3,0.8,max,True,1e-06,0.9904506599404804,COMPLETE,0.9904506599404804
9,0.2176,2025-08-14 17:32:34.794731,2025-08-14 17:32:51.727698,0 days 00:00:16.932967,gelu,128,32,1,0.5,1e-05,1,L2,0,,max,False,0.0001,1.0147707857119692,COMPLETE,1.0147707857119692
10,0.3644,2025-08-14 17:32:51.734573,2025-08-14 17:33:33.297793,0 days 00:00:41.563220,relu,128,16,1,0.1,0.0001,3,minmax,3,0.85,mean,True,0.0,0.019761178316099276,COMPLETE,0.019761178316099276
11,0.3644,2025-08-14 17:33:33.298794,2025-08-14 17:34:14.962341,0 days 00:00:41.663547,relu,128,16,1,0.1,0.0001,3,minmax,3,0.85,mean,True,0.0,0.03341824660478968,COMPLETE,0.03341824660478968
12,0.3976,2025-08-14 17:34:14.963341,2025-08-14 17:34:55.390441,0 days 00:00:40.427100,relu,128,16,0,0.1,0.0001,3,minmax,2,0.75,mean,True,0.0,0.002803398892912307,COMPLETE,0.002803398892912307
13,0.3653,2025-08-14 17:34:55.391440,2025-08-14 17:35:31.985973,0 days 00:00:36.594533,relu,128,16,0,0.4,0.0001,2,minmax,2,0.75,mean,True,0.0,0.017771715412090064,COMPLETE,0.017771715412090064
14,0.3468,2025-08-14 17:35:31.985973,2025-08-14 17:36:12.278138,0 days 00:00:40.292165,tanh,128,16,0,0.1,0.0001,3,minmax,2,,mean,False,0.0,0.042584357861058124,COMPLETE,0.042584357861058124
15,0.3752,2025-08-14 17:36:12.279139,2025-08-14 17:36:23.998919,0 days 00:00:11.719780,relu,128,64,0,0.4,0.0001,2,minmax,1,0.75,mean,True,1e-05,0.4857424037632835,COMPLETE,0.4857424037632835
16,0.3659,2025-08-14 17:36:23.999984,2025-08-14 17:37:06.652582,0 days 00:00:42.652598,relu,512,16,3,0.2,0.0001,3,minmax,3,0.75,mean,True,0.0,0.0008370166845092627,COMPLETE,0.0008370166845092627
17,0.3217,2025-08-14 17:37:06.653583,2025-08-14 17:37:36.219068,0 days 00:00:29.565485,relu,128,16,0,0.1,0.0001,1,minmax,0,,mean,False,0.0,0.8373465739262449,COMPLETE,0.8373465739262449
18,0.364,2025-08-14 17:37:36.220069,2025-08-14 17:38:13.024303,0 days 00:00:36.804234,tanh,128,16,0,0.1,0.001,2,minmax,2,0.9,mean,True,0.0,0.001574750105892323,COMPLETE,0.001574750105892323
19,0.3339,2025-08-14 17:38:13.025303,2025-08-14 17:38:25.634124,0 days 00:00:12.608821,leakyrelu,512,64,1,0.2,1e-05,3,minmax,3,,mean,False,1e-05,0.8522783889647849,COMPLETE,0.8522783889647849
20,0.3396,2025-08-14 17:38:25.635124,2025-08-14 17:38:34.481103,0 days 00:00:08.845979,elu,128,128,1,0.4,0.0001,3,minmax,2,,mean,False,0.0,0.7809950326033344,COMPLETE,0.7809950326033344
21,0.3738,2025-08-14 17:38:34.482103,2025-08-14 17:38:46.214728,0 days 00:00:11.732625,relu,128,64,0,0.4,0.0001,2,minmax,1,0.75,mean,True,1e-05,0.5129200468301006,COMPLETE,0.5129200468301006
22,0.3663,2025-08-14 17:38:46.215728,2025-08-14 17:38:58.017369,0 days 00:00:11.801641,relu,128,64,0,0.4,0.0001,2,minmax,1,0.75,mean,True,1e-05,0.5025324139181058,COMPLETE,0.5025324139181058
23,0.3898,2025-08-14 17:38:58.018369,2025-08-14 17:39:09.789001,0 days 00:00:11.770632,relu,128,64,0,0.4,0.0001,2,minmax,1,0.75,mean,True,1e-05,0.5192639850726848,COMPLETE,0.5192639850726848
24,0.3307,2025-08-14 17:39:09.791003,2025-08-14 17:39:20.149319,0 days 00:00:10.358316,gelu,128,64,0,0.3,0.0001,1,minmax,0,0.95,mean,True,1e-05,0.8516902501943411,COMPLETE,0.8516902501943411
25,0.3514,2025-08-14 17:39:20.150320,2025-08-14 17:39:57.818747,0 days 00:00:37.668427,relu,128,16,0,0.4,0.0001,2,minmax,1,0.7,mean,True,0.0,0.2772805271041355,COMPLETE,0.2772805271041355
26,0.384,2025-08-14 17:39:57.819747,2025-08-14 17:40:41.205454,0 days 00:00:43.385707,relu,128,16,1,0.2,0.0001,3,L2,2,0.8,mean,True,1e-05,0.12629435666600225,COMPLETE,0.12629435666600225
27,0.3699,2025-08-14 17:40:41.206454,2025-08-14 17:40:53.171130,0 days 00:00:11.964676,relu,128,64,1,0.1,0.0001,2,L2,1,0.8,mean,True,1e-05,0.5175692151597076,COMPLETE,0.5175692151597076
28,0.3065,2025-08-14 17:40:53.173131,2025-08-14 17:41:01.894082,0 days 00:00:08.720951,relu,512,128,2,0.1,1e-05,3,L2,2,0.8,mean,True,1e-05,0.8912032442077563,COMPLETE,0.8912032442077563
29,0.3902,2025-08-14 17:41:01.896083,2025-08-14 17:41:14.794968,0 days 00:00:12.898885,leakyrelu,256,64,1,0.3,0.001,3,L2,2,0.9,mean,True,1e-06,0.0018847873554208654,COMPLETE,0.0018847873554208654
