number,value,datetime_start,datetime_complete,duration,params_activation,params_base_dim,params_batch_size,params_do_layer,params_dropout_rate,params_lr,params_n_layers,params_norm,params_norm_layer,params_pca_frac,params_pooling,params_use_pca,params_wd,user_attrs_final_train_loss,state,final_train_loss
0,0.3967,2025-08-14 19:20:35.255392,2025-08-14 19:20:47.222182,0 days 00:00:11.966790,relu,128,64,1,0.4,0.0001,2,minmax,1,0.9,max,True,0.0,0.2327391686355186,COMPLETE,0.2327391686355186
1,0.4062,2025-08-14 19:20:47.223181,2025-08-14 19:21:06.224666,0 days 00:00:19.001485,leakyrelu,512,32,1,0.2,0.001,1,minmax,1,0.7,mean,True,0.0001,0.0033896186642073264,COMPLETE,0.0033896186642073264
2,0.4008,2025-08-14 19:21:06.225666,2025-08-14 19:21:45.639962,0 days 00:00:39.414296,gelu,128,16,1,0.5,0.001,2,L2,2,0.75,mean,True,1e-05,0.052374023686603335,COMPLETE,0.052374023686603335
3,0.2326,2025-08-14 19:21:45.640963,2025-08-14 19:21:56.443411,0 days 00:00:10.802448,leakyrelu,512,64,2,0.5,1e-05,2,minmax,0,,max,False,1e-05,0.9587178153623722,COMPLETE,0.9587178153623722
4,0.4003,2025-08-14 19:21:56.444411,2025-08-14 19:22:04.400906,0 days 00:00:07.956495,leakyrelu,128,128,0,0.4,0.0001,2,minmax,1,0.75,mean,True,1e-06,0.46014416562782606,COMPLETE,0.46014416562782606
5,0.2714,2025-08-14 19:22:04.401906,2025-08-14 19:22:16.826501,0 days 00:00:12.424595,relu,128,64,1,0.4,0.0001,2,L2,2,,max,False,0.0001,0.9670280028386131,COMPLETE,0.9670280028386131
6,0.3835,2025-08-14 19:22:16.827501,2025-08-14 19:22:25.331409,0 days 00:00:08.503908,tanh,256,128,0,0.5,0.0001,2,L2,1,0.85,mean,True,1e-05,0.5361989944502472,COMPLETE,0.5361989944502472
7,0.2176,2025-08-14 19:22:25.332409,2025-08-14 19:22:33.357699,0 days 00:00:08.025290,tanh,512,128,3,0.2,1e-05,3,L2,0,,mean,False,0.0,0.9937921701136893,COMPLETE,0.9937921701136893
8,0.3827,2025-08-14 19:22:33.358699,2025-08-14 19:22:53.155897,0 days 00:00:19.797198,relu,512,32,2,0.2,0.0001,2,minmax,2,,mean,False,0.0001,0.0025059022151616515,COMPLETE,0.0025059022151616515
9,0.4052,2025-08-14 19:22:53.156897,2025-08-14 19:23:11.938750,0 days 00:00:18.781853,gelu,128,32,1,0.4,0.0001,1,L2,1,,mean,False,1e-06,0.08641845471797649,COMPLETE,0.08641845471797649
10,0.3646,2025-08-14 19:23:11.940751,2025-08-14 19:23:28.732015,0 days 00:00:16.791264,elu,256,32,0,0.3,0.001,1,minmax,0,0.7,max,True,0.0001,0.5334393171252162,COMPLETE,0.5334393171252162
11,0.3924,2025-08-14 19:23:28.733014,2025-08-14 19:23:47.677768,0 days 00:00:18.944754,gelu,512,32,1,0.1,0.001,1,L2,1,,mean,False,1e-06,0.00021479859204372913,COMPLETE,0.00021479859204372913
12,0.3949,2025-08-14 19:23:47.678768,2025-08-14 19:24:06.458949,0 days 00:00:18.780181,gelu,128,32,1,0.2,0.001,1,minmax,1,,mean,False,1e-06,0.0016245306112018932,COMPLETE,0.0016245306112018932
13,0.4204,2025-08-14 19:24:06.460950,2025-08-14 19:24:25.560338,0 days 00:00:19.099388,leakyrelu,512,32,1,0.3,0.001,1,L2,1,0.7,mean,True,1e-06,0.002833402142156263,COMPLETE,0.002833402142156263
14,0.4003,2025-08-14 19:24:25.561339,2025-08-14 19:25:00.890229,0 days 00:00:35.328890,leakyrelu,512,16,1,0.3,0.001,1,minmax,1,0.7,mean,True,0.0001,0.005444604014061463,COMPLETE,0.005444604014061463
15,0.4131,2025-08-14 19:25:00.891230,2025-08-14 19:25:22.905700,0 days 00:00:22.014470,leakyrelu,512,32,2,0.3,0.001,3,L2,3,0.7,mean,True,1e-06,4.947394367924688e-05,COMPLETE,4.947394367924688e-05
16,0.4018,2025-08-14 19:25:22.906701,2025-08-14 19:25:44.470871,0 days 00:00:21.564170,leakyrelu,512,32,3,0.3,0.001,3,L2,3,0.95,mean,True,1e-06,3.985463555383708e-05,COMPLETE,3.985463555383708e-05
17,0.3444,2025-08-14 19:25:44.471870,2025-08-14 19:26:07.852209,0 days 00:00:23.380339,elu,256,32,2,0.3,1e-05,3,L2,3,0.8,mean,True,1e-06,0.872300456766147,COMPLETE,0.872300456766147
18,0.4305,2025-08-14 19:26:07.853210,2025-08-14 19:26:49.334745,0 days 00:00:41.481535,leakyrelu,512,16,2,0.3,0.001,3,L2,3,0.7,max,True,1e-06,4.0800729670567094e-05,COMPLETE,4.0800729670567094e-05
19,0.4447,2025-08-14 19:26:49.336745,2025-08-14 19:27:31.087863,0 days 00:00:41.751118,leakyrelu,512,16,3,0.1,0.001,3,L2,2,0.7,max,True,1e-06,1.0161979955397778e-05,COMPLETE,1.0161979955397778e-05
20,0.4032,2025-08-14 19:27:31.088863,2025-08-14 19:28:11.992471,0 days 00:00:40.903608,leakyrelu,512,16,3,0.1,0.001,3,L2,3,0.8,max,True,0.0,1.1299358158496057e-05,COMPLETE,1.1299358158496057e-05
21,0.4381,2025-08-14 19:28:11.993471,2025-08-14 19:28:53.284227,0 days 00:00:41.290756,leakyrelu,512,16,3,0.1,0.001,3,L2,2,0.7,max,True,1e-06,9.046178005098206e-06,COMPLETE,9.046178005098206e-06
22,0.4111,2025-08-14 19:28:53.285228,2025-08-14 19:29:34.563378,0 days 00:00:41.278150,leakyrelu,512,16,3,0.1,0.001,3,L2,2,0.7,max,True,1e-06,1.3621276725366018e-05,COMPLETE,1.3621276725366018e-05
23,0.4353,2025-08-14 19:29:34.565378,2025-08-14 19:30:15.840980,0 days 00:00:41.275602,leakyrelu,512,16,3,0.1,0.001,3,L2,2,0.7,max,True,1e-06,1.5726966766653272e-05,COMPLETE,1.5726966766653272e-05
24,0.437,2025-08-14 19:30:15.841980,2025-08-14 19:30:56.665288,0 days 00:00:40.823308,leakyrelu,512,16,3,0.1,0.001,3,L2,2,0.95,max,True,1e-06,1.9318594185194117e-06,COMPLETE,1.9318594185194117e-06
25,0.4419,2025-08-14 19:30:56.667288,2025-08-14 19:31:40.488586,0 days 00:00:43.821298,tanh,256,16,3,0.1,1e-05,3,L2,2,0.95,max,True,1e-06,0.6052579912342059,COMPLETE,0.6052579912342059
26,0.3986,2025-08-14 19:31:40.489587,2025-08-14 19:32:24.683229,0 days 00:00:44.193642,tanh,256,16,3,0.1,1e-05,3,L2,2,0.95,max,True,1e-06,0.6239343147569147,COMPLETE,0.6239343147569147
27,0.4253,2025-08-14 19:32:24.684229,2025-08-14 19:33:08.772011,0 days 00:00:44.087782,tanh,256,16,3,0.1,1e-05,3,L2,2,0.9,max,True,1e-06,0.680782112661282,COMPLETE,0.680782112661282
28,0.4214,2025-08-14 19:33:08.773011,2025-08-14 19:33:52.815458,0 days 00:00:44.042447,tanh,256,16,2,0.1,1e-05,3,L2,2,0.85,max,True,1e-05,0.7401766520221134,COMPLETE,0.7401766520221134
29,0.2207,2025-08-14 19:33:52.816458,2025-08-14 19:34:05.078917,0 days 00:00:12.262459,elu,256,64,2,0.1,1e-05,2,L2,2,0.95,max,True,0.0,0.9755972547163151,COMPLETE,0.9755972547163151
