number,value,datetime_start,datetime_complete,duration,params_activation,params_base_dim,params_batch_size,params_do_layer,params_dropout_rate,params_lr,params_n_layers,params_norm,params_norm_layer,params_pca_frac,params_pooling,params_use_pca,params_wd,user_attrs_final_train_loss,state,final_train_loss
0,0.3261,2025-08-21 21:33:06.669962,2025-08-21 21:33:10.262247,0 days 00:00:03.592285,relu,512,64,2,0.2,0.001,3,L2,0,0.95,max,True,1e-06,0.0005243098130449653,COMPLETE,0.0005243098130449653
1,0.2603,2025-08-21 21:33:10.263247,2025-08-21 21:33:14.902131,0 days 00:00:04.638884,relu,256,32,0,0.2,0.001,1,L2,0,,max,False,1e-05,0.8920243740081787,COMPLETE,0.8920243740081787
2,0.2504,2025-08-21 21:33:14.903131,2025-08-21 21:33:17.735447,0 days 00:00:02.832316,silu,512,128,1,0.4,1e-05,1,L2,0,0.7,max,True,1e-05,1.0632487535476685,COMPLETE,1.0632487535476685
3,0.2603,2025-08-21 21:33:17.736448,2025-08-21 21:33:20.605090,0 days 00:00:02.868642,tanh,512,128,1,0.1,1e-05,1,L2,0,0.95,max,True,0.0001,1.0305429697036743,COMPLETE,1.0305429697036743
4,0.2603,2025-08-21 21:33:20.607091,2025-08-21 21:33:24.222404,0 days 00:00:03.615313,silu,256,64,1,0.5,1e-05,3,minmax,1,,max,False,0.0001,0.9638087153434753,COMPLETE,0.9638087153434753
5,0.2813,2025-08-21 21:33:24.223405,2025-08-21 21:33:27.549653,0 days 00:00:03.326248,leakyrelu,256,64,0,0.2,1e-05,2,minmax,1,0.7,max,True,1e-05,0.8994561433792114,COMPLETE,0.8994561433792114
6,0.2924,2025-08-21 21:33:27.550655,2025-08-21 21:33:30.925409,0 days 00:00:03.374754,relu,512,64,2,0.5,1e-05,2,minmax,2,0.8,max,True,0.0,0.40695562958717346,COMPLETE,0.40695562958717346
7,0.2603,2025-08-21 21:33:30.926410,2025-08-21 21:33:34.399797,0 days 00:00:03.473387,tanh,256,64,1,0.1,1e-05,2,L2,1,0.75,mean,True,0.0001,0.9214820861816406,COMPLETE,0.9214820861816406
8,0.2603,2025-08-21 21:33:34.400798,2025-08-21 21:33:37.916350,0 days 00:00:03.515552,elu,128,64,1,0.3,1e-05,3,L2,0,,mean,False,1e-06,1.0546152591705322,COMPLETE,1.0546152591705322
9,0.2667,2025-08-21 21:33:37.917351,2025-08-21 21:33:46.414830,0 days 00:00:08.497479,leakyrelu,128,16,2,0.3,0.001,2,L2,1,,mean,False,0.0001,0.0005436294479295612,COMPLETE,0.0005436294479295612
10,0.2367,2025-08-21 21:33:46.415831,2025-08-21 21:33:52.858836,0 days 00:00:06.443005,gelu,512,32,3,0.2,0.0001,3,minmax,3,0.95,mean,True,1e-06,0.007211378123611212,COMPLETE,0.007211378123611212
11,0.2537,2025-08-21 21:33:52.859837,2025-08-21 21:33:56.156575,0 days 00:00:03.296738,relu,512,64,2,0.5,0.001,2,minmax,2,0.8,max,True,0.0,0.0009371046908199787,COMPLETE,0.0009371046908199787
12,0.3463,2025-08-21 21:33:56.157576,2025-08-21 21:34:05.612695,0 days 00:00:09.455119,relu,512,16,3,0.5,0.0001,3,minmax,2,0.85,max,True,0.0,0.0010931266937404872,COMPLETE,0.0010931266937404872
13,0.3408,2025-08-21 21:34:05.613696,2025-08-21 21:34:14.894264,0 days 00:00:09.280568,relu,512,16,3,0.4,0.0001,3,minmax,3,0.85,max,True,1e-06,0.006957505270838738,COMPLETE,0.006957505270838738
14,0.3179,2025-08-21 21:34:14.895264,2025-08-21 21:34:24.101327,0 days 00:00:09.206063,relu,512,16,3,0.4,0.0001,3,minmax,3,0.85,max,True,0.0,0.006258224882185459,COMPLETE,0.006258224882185459
15,0.3611,2025-08-21 21:34:24.101327,2025-08-21 21:34:33.316227,0 days 00:00:09.214900,gelu,512,16,3,0.4,0.0001,3,minmax,3,0.85,max,True,0.0,0.003276768047362566,COMPLETE,0.003276768047362566
16,0.3751,2025-08-21 21:34:33.317227,2025-08-21 21:34:42.421653,0 days 00:00:09.104426,gelu,128,16,3,0.4,0.0001,3,minmax,2,0.85,max,True,0.0,0.032648072391748426,COMPLETE,0.032648072391748426
17,0.2994,2025-08-21 21:34:42.422653,2025-08-21 21:34:51.616417,0 days 00:00:09.193764,gelu,128,16,3,0.4,0.0001,3,minmax,3,0.9,max,True,0.0,0.10918356776237488,COMPLETE,0.10918356776237488
18,0.2102,2025-08-21 21:34:51.617418,2025-08-21 21:35:00.715389,0 days 00:00:09.097971,gelu,128,16,3,0.4,0.0001,3,minmax,2,,mean,False,0.0,0.058786287903785706,COMPLETE,0.058786287903785706
19,0.3714,2025-08-21 21:35:00.716389,2025-08-21 21:35:08.770244,0 days 00:00:08.053855,gelu,128,16,0,0.4,0.0001,2,minmax,2,0.85,max,True,0.0,0.028959163278341294,COMPLETE,0.028959163278341294
20,0.2982,2025-08-21 21:35:08.771244,2025-08-21 21:35:16.837558,0 days 00:00:08.066314,gelu,128,16,0,0.4,0.0001,2,minmax,1,0.85,max,True,0.0,0.02380094975233078,COMPLETE,0.02380094975233078
21,0.345,2025-08-21 21:35:16.838558,2025-08-21 21:35:24.887731,0 days 00:00:08.049173,gelu,128,16,0,0.4,0.0001,2,minmax,2,0.85,max,True,0.0,0.027851997315883635,COMPLETE,0.027851997315883635
22,0.3472,2025-08-21 21:35:24.888731,2025-08-21 21:35:32.925944,0 days 00:00:08.037213,gelu,128,16,0,0.4,0.0001,2,minmax,2,0.85,max,True,0.0,0.030516600236296654,COMPLETE,0.030516600236296654
23,0.3348,2025-08-21 21:35:32.926944,2025-08-21 21:35:42.107531,0 days 00:00:09.180587,gelu,128,16,2,0.4,0.0001,3,minmax,3,0.85,max,True,0.0,0.08286929130554199,COMPLETE,0.08286929130554199
24,0.324,2025-08-21 21:35:42.108532,2025-08-21 21:35:47.109314,0 days 00:00:05.000782,elu,128,32,0,0.4,0.0001,1,minmax,1,0.9,max,True,0.0,0.25878114700317384,COMPLETE,0.25878114700317384
25,0.2401,2025-08-21 21:35:47.110314,2025-08-21 21:35:50.470068,0 days 00:00:03.359754,gelu,128,128,2,0.1,0.0001,2,minmax,2,0.75,max,True,0.0,0.14059604704380035,COMPLETE,0.14059604704380035
26,0.2539,2025-08-21 21:35:50.471067,2025-08-21 21:35:59.616420,0 days 00:00:09.145353,gelu,128,16,3,0.4,0.0001,3,minmax,3,,mean,False,0.0,0.10698307007551193,COMPLETE,0.10698307007551193
27,0.2852,2025-08-21 21:35:59.617420,2025-08-21 21:36:07.896729,0 days 00:00:08.279309,gelu,128,16,1,0.3,0.0001,2,minmax,1,0.85,max,True,0.0,0.055101553350687026,COMPLETE,0.055101553350687026
28,0.3341,2025-08-21 21:36:07.897729,2025-08-21 21:36:17.310455,0 days 00:00:09.412726,gelu,256,16,3,0.4,0.0001,3,minmax,2,0.85,max,True,1e-05,0.004675689991563559,COMPLETE,0.004675689991563559
29,0.3538,2025-08-21 21:36:17.312455,2025-08-21 21:36:26.620924,0 days 00:00:09.308469,tanh,128,16,2,0.4,0.001,3,minmax,3,0.85,max,True,1e-06,0.0021612212527543305,COMPLETE,0.0021612212527543305
