number,value,datetime_start,datetime_complete,duration,params_activation,params_architecture_pattern,params_batch_size,params_bidirectional,params_dropout,params_dropout_layer_1,params_dropout_layer_2,params_dropout_layer_3,params_dropout_layer_4,params_fc_hidden,params_first_size_idx,params_lr,params_momentum,params_norm,params_norm_layer_1,params_norm_layer_2,params_norm_layer_3,params_norm_layer_4,params_norm_post_lstm,params_num_layers,params_optimizer,params_pooling,params_size_idx,params_weight_decay,system_attrs_completed_rung_0,system_attrs_completed_rung_1,system_attrs_completed_rung_2,system_attrs_completed_rung_3,system_attrs_completed_rung_4,state
0,0.4237961355297668,2025-09-11 19:59:02.643972,2025-09-11 20:00:22.279315,0 days 00:01:19.635343,,uniform,16,False,0.5,False,,,,,,0.001,,L2,True,,,,True,2,RMSprop,max,2.0,1e-05,0.21761658031088082,0.32217261904761907,0.30122482597374994,0.21875,0.43805704099821746,COMPLETE
1,0.08888888888888889,2025-09-11 20:00:22.281316,2025-09-11 20:00:26.951248,0 days 00:00:04.669932,silu,decreasing,96,False,0.1,False,True,False,True,64.0,9.0,0.0001,0.30000000000000004,minmax,False,False,True,False,False,5,SGD,last,,2e-07,0.08888888888888889,,,,,PRUNED
2,0.21759048895761182,2025-09-11 20:00:26.953251,2025-09-11 20:01:22.874061,0 days 00:00:55.920810,relu,decreasing,16,True,0.4,False,False,,,512.0,3.0,1e-05,,minmax,False,False,,,True,3,Adam,mean,,5e-07,0.178030303030303,0.178030303030303,0.21640488656195464,,,COMPLETE
3,0.21761658031088082,2025-09-11 20:01:22.876062,2025-09-11 20:01:34.784734,0 days 00:00:11.908672,tanh,increasing,96,True,0.4,,,,,128.0,12.0,0.0002,,minmax,,,,,True,1,Adam,mean,,1e-06,0.21761658031088082,0.21761658031088082,,,,PRUNED
4,0.21761658031088082,2025-09-11 20:01:34.785734,2025-09-11 20:01:48.033425,0 days 00:00:13.247691,leakyrelu,uniform,128,False,0.30000000000000004,True,False,,,768.0,,0.001,0.0,L2,False,False,,,True,3,SGD,last,10.0,2e-07,0.21761658031088082,0.21761658031088082,,,,PRUNED
5,0.21759048895761182,2025-09-11 20:01:48.034425,2025-09-11 20:05:50.834997,0 days 00:04:02.800572,gelu,increasing,128,True,0.0,False,False,True,False,128.0,7.0,2e-05,,minmax,True,False,False,True,True,5,AdamW,last,,1e-06,0.17702448210922786,0.21875,0.21875,0.178030303030303,,COMPLETE
6,0.21761658031088082,2025-09-11 20:05:50.836997,2025-09-11 20:07:06.988246,0 days 00:01:16.151249,silu,uniform,16,True,0.5,True,,,,768.0,,0.0001,,L2,True,,,,True,2,AdamW,mean,13.0,2e-07,0.21761658031088082,0.21761658031088082,,,,PRUNED
7,0.178030303030303,2025-09-11 20:07:06.989246,2025-09-11 20:07:41.039175,0 days 00:00:34.049929,,increasing,64,False,0.2,True,,,,,10.0,0.001,,L2,True,,,,False,2,AdamW,max,,2e-07,0.2803663878932696,0.28325180526438387,0.178030303030303,,,PRUNED
8,0.17702448210922786,2025-09-11 20:07:41.040175,2025-09-11 20:07:42.928623,0 days 00:00:01.888448,relu,increasing,64,False,0.5,False,,,,64.0,0.0,5e-05,0.9,minmax,False,,,,False,2,SGD,max,,2e-06,0.17702448210922786,,,,,PRUNED
9,0.21761658031088082,2025-09-11 20:07:42.928623,2025-09-11 20:07:58.662177,0 days 00:00:15.733554,silu,uniform,16,True,0.4,False,False,True,False,1024.0,,0.002,0.9,L2,True,True,False,False,True,5,SGD,mean,3.0,5e-07,0.21761658031088082,0.21761658031088082,,,,PRUNED
10,0.21761658031088082,2025-09-11 20:07:58.663177,2025-09-11 20:08:01.574933,0 days 00:00:02.911756,,uniform,32,False,0.2,,,,,,,0.01,,L2,,,,,False,1,RMSprop,max,0.0,1e-05,0.21761658031088082,,,,,PRUNED
11,0.21761658031088082,2025-09-11 20:08:01.575933,2025-09-11 20:08:12.030569,0 days 00:00:10.454636,elu,decreasing,16,True,0.4,False,True,,,512.0,3.0,1e-05,,minmax,False,True,,,True,3,RMSprop,mean,,5e-07,0.21761658031088082,,,,,PRUNED
12,0.21761658031088082,2025-09-11 20:08:12.032570,2025-09-11 20:08:28.988266,0 days 00:00:16.955696,relu,decreasing,16,True,0.5,False,False,False,,256.0,6.0,1e-05,,L2,False,False,True,,True,4,Adam,max,,1e-07,0.21761658031088082,,,,,PRUNED
13,0.21875,2025-09-11 20:08:28.990266,2025-09-11 20:08:49.506173,0 days 00:00:20.515907,relu,decreasing,16,False,0.30000000000000004,False,False,False,,512.0,5.0,1e-05,,minmax,True,False,True,,True,4,RMSprop,mean,,1e-05,0.21761658031088082,0.21761658031088082,0.21875,,,PRUNED
14,0.17702448210922786,2025-09-11 20:08:49.507173,2025-09-11 20:08:52.541329,0 days 00:00:03.034156,elu,uniform,32,False,0.4,False,True,,,512.0,,0.001,,L2,True,True,,,True,3,Adam,max,5.0,0.0,0.17702448210922786,,,,,PRUNED
15,0.17702448210922786,2025-09-11 20:08:52.542329,2025-09-11 20:08:55.878925,0 days 00:00:03.336596,,decreasing,16,True,0.5,False,,,,,2.0,5e-05,,minmax,False,,,,True,2,RMSprop,max,,1e-05,0.17702448210922786,,,,,PRUNED
16,0.178030303030303,2025-09-11 20:08:55.878925,2025-09-11 20:09:19.345062,0 days 00:00:23.466137,leakyrelu,uniform,16,True,0.30000000000000004,True,False,True,,256.0,,0.01,,minmax,False,False,False,,True,4,Adam,mean,0.0,5e-07,0.21761658031088082,0.21761658031088082,0.178030303030303,,,PRUNED
17,0.22084110253819542,2025-09-11 20:09:19.346062,2025-09-11 20:09:36.582354,0 days 00:00:17.236292,gelu,decreasing,16,False,0.4,,,,,1024.0,0.0,2e-05,,L2,,,,,True,1,Adam,mean,,0.0,0.178030303030303,0.178030303030303,0.21640488656195464,,,COMPLETE
18,0.21875,2025-09-11 20:09:36.583354,2025-09-11 20:09:42.500533,0 days 00:00:05.917179,gelu,uniform,128,False,0.5,,,,,1024.0,,2e-05,,L2,,,,,False,1,RMSprop,max,7.0,0.0,0.21761658031088082,0.21761658031088082,0.21875,,,PRUNED
19,0.21875,2025-09-11 20:09:42.501533,2025-09-11 20:09:46.576450,0 days 00:00:04.074917,gelu,decreasing,96,False,0.30000000000000004,,,,,1024.0,0.0,2e-05,,L2,,,,,True,1,Adam,last,,0.0,0.21761658031088082,0.21875,,,,PRUNED
20,0.24426406926406927,2025-09-11 20:09:46.577450,2025-09-11 20:10:31.191441,0 days 00:00:44.613991,,decreasing,64,False,0.4,True,,,,,13.0,0.0002,,L2,True,,,,True,2,RMSprop,max,,1e-07,0.31787639195574235,0.21761658031088082,0.24426406926406927,,,PRUNED
21,0.178030303030303,2025-09-11 20:10:31.192441,2025-09-11 20:10:47.238617,0 days 00:00:16.046176,tanh,decreasing,16,False,0.4,False,True,,,512.0,4.0,0.002,,L2,True,True,,,True,3,Adam,mean,,2e-06,0.21761658031088082,0.178030303030303,,,,PRUNED
22,0.4032949579379072,2025-09-11 20:10:47.240617,2025-09-11 20:12:15.033955,0 days 00:01:27.793338,gelu,decreasing,16,False,0.5,False,,,,1024.0,2.0,0.001,,L2,False,,,,True,2,Adam,mean,,1e-05,0.21761658031088082,0.3443549134018709,0.38473193353876395,0.178030303030303,,COMPLETE
23,0.17702448210922786,2025-09-11 20:12:15.035955,2025-09-11 20:12:17.311494,0 days 00:00:02.275539,gelu,decreasing,16,False,0.5,,,,,1024.0,1.0,0.001,,L2,,,,,True,1,Adam,mean,,1e-05,0.17702448210922786,,,,,PRUNED
24,0.178030303030303,2025-09-11 20:12:17.312494,2025-09-11 20:12:39.167585,0 days 00:00:21.855091,gelu,decreasing,16,False,0.5,False,,,,1024.0,2.0,0.001,,L2,False,,,,True,2,Adam,mean,,1e-05,0.21761658031088082,0.21761658031088082,0.35337995337995337,0.178030303030303,,PRUNED
25,0.21875,2025-09-11 20:12:39.168586,2025-09-11 20:12:44.724777,0 days 00:00:05.556191,gelu,uniform,32,False,0.5,,,,,1024.0,,2e-05,,L2,,,,,True,1,Adam,mean,3.0,0.0,0.21761658031088082,0.21875,,,,PRUNED
26,0.2743917159011499,2025-09-11 20:12:44.725777,2025-09-11 20:13:00.017157,0 days 00:00:15.291380,gelu,decreasing,16,False,0.4,False,,,,1024.0,4.0,0.001,,L2,True,,,,False,2,RMSprop,mean,,1e-05,0.21761658031088082,0.21761658031088082,0.2743917159011499,,,PRUNED
27,0.21875,2025-09-11 20:13:00.018158,2025-09-11 20:13:17.934125,0 days 00:00:17.915967,,decreasing,16,False,0.5,False,,,,,7.0,0.001,,L2,False,,,,True,2,AdamW,mean,,1e-05,0.21761658031088082,0.21761658031088082,0.21875,,,PRUNED
28,0.2548679390784654,2025-09-11 20:13:17.935126,2025-09-11 20:13:24.663397,0 days 00:00:06.728271,gelu,increasing,16,False,0.2,,,,,1024.0,0.0,2e-05,,L2,,,,,True,1,Adam,last,,0.0,0.21761658031088082,0.2548679390784654,,,,PRUNED
29,0.08558558558558559,2025-09-11 20:13:24.664397,2025-09-11 20:13:34.717755,0 days 00:00:10.053358,tanh,uniform,96,False,0.1,True,,,,64.0,,0.0001,0.5,L2,True,,,,False,2,SGD,max,7.0,1e-05,0.21761658031088082,0.21761658031088082,0.08558558558558559,,,PRUNED
30,0.14161220043572986,2025-09-11 20:13:34.718756,2025-09-11 20:13:41.126438,0 days 00:00:06.407682,elu,decreasing,32,False,0.30000000000000004,,,,,128.0,2.0,0.001,,L2,,,,,True,1,RMSprop,last,,1e-07,0.14161220043572986,,,,,PRUNED
31,0.178030303030303,2025-09-11 20:13:41.127438,2025-09-11 20:14:02.536244,0 days 00:00:21.408806,relu,decreasing,16,True,0.4,False,False,,,512.0,4.0,1e-05,,minmax,False,False,,,True,3,Adam,mean,,5e-07,0.21761658031088082,0.21761658031088082,0.178030303030303,,,PRUNED
32,0.21875,2025-09-11 20:14:02.537243,2025-09-11 20:14:31.310430,0 days 00:00:28.773187,relu,decreasing,16,True,0.4,False,False,True,,768.0,5.0,0.0002,,minmax,False,False,True,,True,4,Adam,mean,,1e-06,0.21761658031088082,0.21761658031088082,0.21875,,,PRUNED
33,0.178030303030303,2025-09-11 20:14:31.312431,2025-09-11 20:14:37.477455,0 days 00:00:06.165024,leakyrelu,decreasing,96,False,0.4,False,True,,,256.0,3.0,1e-05,,minmax,False,True,,,True,3,Adam,mean,,5e-07,0.21761658031088082,0.178030303030303,,,,PRUNED
34,0.21759048895761182,2025-09-11 20:14:37.478456,2025-09-11 20:14:57.717114,0 days 00:00:20.238658,relu,decreasing,128,True,0.5,False,False,,,64.0,3.0,5e-05,,minmax,False,False,,,True,3,Adam,mean,,2e-06,0.21875,0.21640488656195464,,,,COMPLETE
35,0.08558558558558559,2025-09-11 20:14:57.719113,2025-09-11 20:15:09.108870,0 days 00:00:11.389757,,increasing,16,False,0.0,False,,,,,1.0,2e-05,,L2,False,,,,True,2,Adam,mean,,0.0,0.08558558558558559,,,,,PRUNED
36,0.21875,2025-09-11 20:15:09.110870,2025-09-11 20:15:29.120058,0 days 00:00:20.009188,silu,uniform,16,True,0.4,False,False,,,128.0,,0.0001,,minmax,False,False,,,True,3,AdamW,last,2.0,2e-07,0.21761658031088082,0.21761658031088082,0.21875,,,PRUNED
37,0.21875,2025-09-11 20:15:29.121058,2025-09-11 20:15:34.788015,0 days 00:00:05.666957,gelu,decreasing,64,False,0.30000000000000004,False,,,,768.0,2.0,0.001,0.0,L2,True,,,,True,2,SGD,mean,,1e-06,0.21761658031088082,0.21761658031088082,0.21875,,,PRUNED
38,0.21761658031088082,2025-09-11 20:15:34.789015,2025-09-11 20:15:39.742131,0 days 00:00:04.953116,tanh,increasing,128,True,0.5,,,,,512.0,1.0,0.002,,L2,,,,,False,1,Adam,mean,,5e-07,0.21761658031088082,0.21761658031088082,0.21761658031088082,,,PRUNED
39,0.21875,2025-09-11 20:15:39.743130,2025-09-11 20:15:53.008092,0 days 00:00:13.264962,gelu,uniform,16,False,0.1,False,,,,1024.0,,0.01,,minmax,False,,,,True,2,AdamW,max,5.0,1e-05,0.21761658031088082,0.21875,,,,PRUNED
40,0.178030303030303,2025-09-11 20:15:53.009092,2025-09-11 20:16:01.441112,0 days 00:00:08.432020,,decreasing,16,True,0.5,,,,,,0.0,0.0002,0.6000000000000001,L2,,,,,True,1,SGD,mean,,2e-07,0.21761658031088082,0.178030303030303,,,,PRUNED
41,0.17702448210922786,2025-09-11 20:16:01.442112,2025-09-11 20:16:40.455960,0 days 00:00:39.013848,gelu,increasing,128,True,0.2,False,False,True,False,128.0,7.0,2e-05,,minmax,True,False,False,True,True,5,AdamW,last,,1e-06,0.2607000593270616,0.17702448210922786,,,,PRUNED
42,0.178030303030303,2025-09-11 20:16:40.456961,2025-09-11 20:18:02.169544,0 days 00:01:21.712583,gelu,increasing,128,True,0.0,False,False,True,False,128.0,7.0,2e-05,,minmax,True,False,False,True,True,5,AdamW,last,,1e-06,0.21761658031088082,0.21761658031088082,0.178030303030303,,,PRUNED
43,0.17702448210922786,2025-09-11 20:18:02.170544,2025-09-11 20:18:15.543390,0 days 00:00:13.372846,gelu,increasing,128,True,0.1,False,False,True,,128.0,8.0,1e-05,,minmax,True,False,False,,True,4,AdamW,last,,1e-06,0.17702448210922786,,,,,PRUNED
44,0.21640488656195464,2025-09-11 20:18:15.544390,2025-09-11 20:19:41.849034,0 days 00:01:26.304644,leakyrelu,increasing,64,True,0.2,False,False,False,,128.0,6.0,2e-05,,minmax,True,False,False,,True,4,AdamW,last,,1e-06,0.21761658031088082,0.21761658031088082,0.21875,0.21875,0.21640488656195464,PRUNED
45,0.08558558558558559,2025-09-11 20:19:41.850035,2025-09-11 20:20:44.870399,0 days 00:01:03.020364,silu,increasing,128,True,0.0,True,False,,,512.0,9.0,0.001,,minmax,True,False,,,False,3,RMSprop,max,,5e-07,0.21761658031088082,0.21761658031088082,0.08558558558558559,,,PRUNED
46,0.21640488656195464,2025-09-11 20:20:44.871399,2025-09-11 20:23:08.682072,0 days 00:02:23.810673,relu,uniform,16,False,0.30000000000000004,False,True,True,True,768.0,,1e-05,,minmax,True,True,False,True,True,5,Adam,last,9.0,1e-05,0.21761658031088082,0.21761658031088082,0.21875,0.21875,0.21640488656195464,PRUNED
47,0.178030303030303,2025-09-11 20:23:08.683072,2025-09-11 20:24:17.625973,0 days 00:01:08.942901,gelu,decreasing,96,True,0.5,True,False,,,64.0,11.0,5e-05,,L2,False,False,,,True,3,RMSprop,max,,2e-06,0.21761658031088082,0.178030303030303,,,,PRUNED
48,0.21759048895761182,2025-09-11 20:24:17.626973,2025-09-11 20:25:08.897579,0 days 00:00:51.270606,elu,uniform,16,False,0.4,False,False,True,,256.0,,2e-05,,L2,True,False,False,,True,4,Adam,mean,2.0,0.0,0.21875,0.21640488656195464,,,,COMPLETE
49,0.178030303030303,2025-09-11 20:25:08.898579,2025-09-11 20:26:09.591248,0 days 00:01:00.692669,relu,decreasing,32,True,0.30000000000000004,False,,,,1024.0,9.0,0.01,,minmax,False,,,,True,2,AdamW,max,,5e-07,0.178030303030303,0.178030303030303,0.178030303030303,,,PRUNED
