number,value,datetime_start,datetime_complete,duration,params_activation,params_architecture_pattern,params_batch_size,params_bidirectional,params_dropout,params_dropout_layer_1,params_dropout_layer_2,params_dropout_layer_3,params_dropout_layer_4,params_fc_hidden,params_first_size_idx,params_lr,params_momentum_sgd,params_norm,params_norm_layer_1,params_norm_layer_2,params_norm_layer_3,params_norm_layer_4,params_norm_post_lstm,params_num_layers,params_optimizer,params_pooling,params_size_idx,params_weight_decay,system_attrs_completed_rung_0,system_attrs_completed_rung_1,system_attrs_completed_rung_2,system_attrs_completed_rung_3,state
0,0.4072335210815164,2025-09-12 03:37:12.175675,2025-09-12 03:37:58.969602,0 days 00:00:46.793927,,uniform,16,False,0.5,False,,,,,,0.001,,L2,True,,,,True,2,RMSprop,max,1.0,1e-05,0.3735662853739839,0.21875,0.178030303030303,,COMPLETE
1,0.178030303030303,2025-09-12 03:37:58.971602,2025-09-12 03:38:16.579416,0 days 00:00:17.607814,silu,decreasing,96,False,0.1,False,True,False,True,64.0,7.0,0.0001,0.3,minmax,False,False,True,False,False,5,SGD,last,,2e-07,0.178030303030303,,,,PRUNED
2,0.2175904889576118,2025-09-12 03:38:16.580416,2025-09-12 03:39:24.210851,0 days 00:01:07.630435,relu,decreasing,16,True,0.4,False,False,,,512.0,2.0,1e-05,,minmax,False,False,,,True,3,Adam,mean,,5e-07,0.178030303030303,0.2164048865619546,,,COMPLETE
3,0.2175904889576118,2025-09-12 03:39:24.226479,2025-09-12 03:39:55.162355,0 days 00:00:30.935876,tanh,increasing,96,True,0.4,,,,,128.0,8.0,0.0002,,minmax,,,,,True,1,Adam,mean,,1e-06,0.2176165803108808,0.178030303030303,0.178030303030303,0.178030303030303,COMPLETE
4,0.2237048275071835,2025-09-12 03:39:55.162355,2025-09-12 03:40:37.021962,0 days 00:00:41.859607,leakyrelu,uniform,128,False,0.3,True,False,,,768.0,,0.001,0.0,L2,False,False,,,True,3,SGD,last,7.0,2e-07,0.178030303030303,0.2164048865619546,,,COMPLETE
5,0.2175904889576118,2025-09-12 03:40:37.021962,2025-09-12 03:42:34.076894,0 days 00:01:57.054932,gelu,increasing,128,True,0.0,False,False,True,False,128.0,4.0,2e-05,,minmax,True,False,False,True,True,5,AdamW,last,,1e-06,0.2176165803108808,0.21875,0.21875,0.2164048865619546,COMPLETE
6,0.399645018126112,2025-09-12 03:42:34.077894,2025-09-12 03:47:16.396764,0 days 00:04:42.318870,silu,uniform,16,True,0.5,True,,,,768.0,,0.0001,,L2,True,,,,True,2,AdamW,mean,9.0,2e-07,0.21875,0.2164048865619546,,,COMPLETE
7,0.178030303030303,2025-09-12 03:47:16.398764,2025-09-12 03:47:29.993825,0 days 00:00:13.595061,,increasing,64,False,0.2,True,,,,,7.0,0.001,,L2,True,,,,False,2,AdamW,max,,2e-07,0.2878541191794204,0.178030303030303,,,PRUNED
8,0.0855855855855855,2025-09-12 03:47:29.994825,2025-09-12 03:47:35.031960,0 days 00:00:05.037135,relu,increasing,64,False,0.5,False,,,,64.0,0.0,5e-05,0.9,minmax,False,,,,False,2,SGD,max,,2e-06,0.0855855855855855,,,,PRUNED
9,0.178030303030303,2025-09-12 03:47:35.032959,2025-09-12 03:48:47.920364,0 days 00:01:12.887405,silu,uniform,16,True,0.4,False,False,True,False,1024.0,,0.002,0.9,L2,True,True,False,False,True,5,SGD,mean,2.0,5e-07,0.21875,0.178030303030303,,,PRUNED
10,0.178030303030303,2025-09-12 03:48:47.921364,2025-09-12 03:48:55.535078,0 days 00:00:07.613714,,uniform,32,False,0.2,,,,,,,0.01,,L2,,,,,False,1,RMSprop,max,0.0,1e-05,0.3099117350529779,0.3432765151515151,0.178030303030303,,PRUNED
11,0.178030303030303,2025-09-12 03:48:55.536078,2025-09-12 03:52:17.920630,0 days 00:03:22.384552,elu,uniform,16,True,0.5,True,,,,768.0,,0.0001,,L2,True,,,,True,2,RMSprop,mean,9.0,0.0,0.178030303030303,0.178030303030303,,,PRUNED
12,0.3926535114940912,2025-09-12 03:52:17.921630,2025-09-12 03:53:14.044263,0 days 00:00:56.122633,silu,uniform,16,False,0.5,True,,,,256.0,,0.0001,,L2,True,,,,True,2,RMSprop,max,4.0,1e-07,0.21875,0.3197591680350301,,,COMPLETE
13,0.2176165803108808,2025-09-12 03:53:14.046263,2025-09-12 03:53:44.156040,0 days 00:00:30.109777,gelu,uniform,16,True,0.3,True,True,False,,768.0,,0.001,,L2,True,True,True,,True,4,AdamW,mean,5.0,1e-05,0.2176165803108808,,,,PRUNED
14,0.21875,2025-09-12 03:53:44.157040,2025-09-12 03:53:50.692512,0 days 00:00:06.535472,,uniform,32,True,0.5,,,,,,,0.01,,L2,,,,,True,1,AdamW,max,0.0,1e-05,0.21875,,,,PRUNED
15,0.178030303030303,2025-09-12 03:53:50.693512,2025-09-12 03:55:41.882537,0 days 00:01:51.189025,leakyrelu,uniform,16,False,0.4,False,True,,,1024.0,,5e-05,,L2,True,True,,,True,3,RMSprop,mean,9.0,2e-06,0.4582561178427179,0.21875,0.21875,0.178030303030303,PRUNED
16,0.4050308448001131,2025-09-12 03:55:41.883538,2025-09-12 03:58:50.342956,0 days 00:03:08.459418,elu,decreasing,16,False,0.3,True,True,False,,512.0,9.0,1e-05,,L2,True,True,False,,True,4,AdamW,max,,0.0,0.3534327800733011,0.3719413919413919,0.21875,0.2164048865619546,COMPLETE
17,0.4241562723968501,2025-09-12 03:58:50.344957,2025-09-12 04:03:20.269222,0 days 00:04:29.924265,elu,decreasing,16,False,0.1,False,True,False,,512.0,9.0,1e-05,,L2,True,True,False,,True,4,RMSprop,max,,0.0,0.3096926713947991,0.3209445639758811,0.21875,0.4008729422277211,COMPLETE
18,0.4008776105817664,2025-09-12 04:03:20.271223,2025-09-12 04:05:28.343892,0 days 00:02:08.072669,elu,decreasing,32,False,0.0,False,True,False,,512.0,9.0,1e-05,,L2,True,True,False,,False,4,RMSprop,max,,0.0,0.21875,0.2164048865619546,,,COMPLETE
19,0.2175904889576118,2025-09-12 04:05:28.345892,2025-09-12 04:06:05.483141,0 days 00:00:37.137249,tanh,decreasing,64,False,0.1,False,True,False,,256.0,5.0,0.002,,L2,True,True,False,,True,4,RMSprop,max,,1e-07,0.21875,0.2164048865619546,,,COMPLETE
20,0.3808980296883035,2025-09-12 04:06:05.485142,2025-09-12 04:06:49.324455,0 days 00:00:43.839313,,decreasing,128,False,0.1,False,True,,,,6.0,2e-05,,L2,True,True,,,True,3,RMSprop,max,,1e-05,0.2485065710872162,0.21875,0.2314327485380116,,COMPLETE
21,0.4263189845721409,2025-09-12 04:06:49.327456,2025-09-12 04:10:36.789007,0 days 00:03:47.461551,elu,decreasing,16,False,0.2,True,True,False,,512.0,9.0,1e-05,,L2,True,True,False,,True,4,RMSprop,max,,0.0,0.21875,0.295349484823169,,,COMPLETE
22,0.178030303030303,2025-09-12 04:10:36.790008,2025-09-12 04:12:21.127340,0 days 00:01:44.337332,elu,decreasing,16,False,0.2,False,True,False,,512.0,9.0,1e-05,,L2,True,True,False,,True,4,RMSprop,max,,0.0,0.3462157809983897,0.178030303030303,,,PRUNED
23,0.4031501487713158,2025-09-12 04:12:21.129341,2025-09-12 04:15:03.919607,0 days 00:02:42.790266,elu,decreasing,16,False,0.1,False,True,,,512.0,8.0,1e-05,,L2,True,True,,,True,3,RMSprop,max,,0.0,0.3551771585827313,0.321718931475029,0.21875,0.2164048865619546,COMPLETE
24,0.0855855855855855,2025-09-12 04:15:03.921608,2025-09-12 04:16:05.075281,0 days 00:01:01.153673,elu,decreasing,16,False,0.2,True,True,False,,512.0,8.0,0.0002,,L2,True,True,False,,True,4,RMSprop,max,,0.0,0.3149361482694816,0.3379315403147092,0.0855855855855855,,PRUNED
25,0.0855855855855855,2025-09-12 04:16:05.076281,2025-09-12 04:16:36.697823,0 days 00:00:31.621542,elu,decreasing,96,False,0.0,False,True,True,True,512.0,9.0,0.001,,L2,False,True,True,True,True,5,Adam,max,,0.0,0.0855855855855855,,,,PRUNED
26,0.3543877619278929,2025-09-12 04:16:36.698823,2025-09-12 04:18:51.393528,0 days 00:02:14.694705,,decreasing,16,False,0.1,True,True,,,,7.0,1e-05,,minmax,True,True,,,False,3,RMSprop,last,,1e-05,0.21875,0.3132249322493225,,,COMPLETE
27,0.4325638693990362,2025-09-12 04:18:51.396529,2025-09-12 04:20:41.615531,0 days 00:01:50.219002,elu,decreasing,16,False,0.3,False,False,False,,512.0,6.0,1e-05,,L2,True,False,False,,True,4,RMSprop,max,,0.0,0.21875,0.3995833636121406,,,COMPLETE
28,0.178030303030303,2025-09-12 04:20:41.616531,2025-09-12 04:21:54.351545,0 days 00:01:12.735014,elu,decreasing,16,False,0.2,False,False,False,,512.0,6.0,1e-05,,L2,True,False,False,,True,4,RMSprop,max,,0.0,0.21875,0.178030303030303,,,PRUNED
29,0.21875,2025-09-12 04:21:54.352546,2025-09-12 04:22:49.798746,0 days 00:00:55.446200,elu,decreasing,16,False,0.3,True,False,False,True,512.0,8.0,1e-05,,L2,False,False,False,True,True,5,RMSprop,max,,0.0,0.21875,,,,PRUNED
30,0.21875,2025-09-12 04:22:49.799746,2025-09-12 04:23:08.485045,0 days 00:00:18.685299,elu,decreasing,32,False,0.3,False,False,False,,512.0,5.0,1e-05,,L2,True,False,False,,True,4,RMSprop,max,,0.0,0.3625,0.21875,,,PRUNED
31,0.1770244821092278,2025-09-12 04:23:08.485045,2025-09-12 04:23:23.351536,0 days 00:00:14.866491,elu,decreasing,96,False,0.1,False,False,False,False,64.0,8.0,0.001,,L2,True,False,False,False,True,5,RMSprop,max,,0.0,0.1770244821092278,,,,PRUNED
32,0.2176165803108808,2025-09-12 04:23:23.353536,2025-09-12 04:23:40.286170,0 days 00:00:16.932634,gelu,decreasing,16,False,0.2,False,False,False,,512.0,5.0,1e-05,,minmax,True,False,False,,True,4,Adam,last,,5e-07,0.2176165803108808,,,,PRUNED
33,0.178030303030303,2025-09-12 04:23:40.287171,2025-09-12 04:24:02.401380,0 days 00:00:22.114209,tanh,decreasing,16,False,0.4,False,True,,,128.0,4.0,0.0002,,L2,True,True,,,True,3,RMSprop,max,,1e-06,0.178030303030303,,,,PRUNED
34,0.21875,2025-09-12 04:24:02.403381,2025-09-12 04:24:20.631429,0 days 00:00:18.228048,relu,increasing,96,False,0.4,False,True,,,1024.0,6.0,1e-05,,minmax,True,True,,,False,3,Adam,max,,1e-07,0.21875,,,,PRUNED
35,0.0894854586129754,2025-09-12 04:24:20.632429,2025-09-12 04:25:16.266206,0 days 00:00:55.633777,leakyrelu,decreasing,128,False,0.0,False,False,True,True,256.0,9.0,2e-05,0.5,L2,False,False,True,True,True,5,SGD,last,,2e-06,0.21875,0.0894854586129754,,,PRUNED
36,0.2164048865619546,2025-09-12 04:25:16.267206,2025-09-12 04:26:09.793976,0 days 00:00:53.526770,elu,increasing,16,False,0.3,False,True,False,,128.0,2.0,0.001,,minmax,True,True,False,,True,4,RMSprop,max,,1e-06,0.21875,0.21875,0.2164048865619546,,PRUNED
37,0.2175904889576118,2025-09-12 04:26:09.794976,2025-09-12 04:27:45.825067,0 days 00:01:36.030091,relu,decreasing,16,False,0.2,False,False,,,64.0,7.0,0.01,,L2,False,False,,,True,3,RMSprop,max,,2e-07,0.21875,0.21875,0.2164048865619546,,COMPLETE
38,0.1502466525722339,2025-09-12 04:27:45.826068,2025-09-12 04:27:57.491134,0 days 00:00:11.665066,,uniform,64,False,0.1,True,,,,,,5e-05,0.5,L2,True,,,,True,2,SGD,last,2.0,5e-07,0.3015390553384474,0.1502466525722339,,,PRUNED
39,0.178030303030303,2025-09-12 04:27:57.493134,2025-09-12 04:28:05.075109,0 days 00:00:07.581975,elu,increasing,128,True,0.3,,,,,512.0,1.0,1e-05,,minmax,,,,,False,1,Adam,max,,1e-05,0.21875,0.21875,0.178030303030303,,PRUNED
40,0.2176165803108808,2025-09-12 04:28:05.076110,2025-09-12 04:28:22.255934,0 days 00:00:17.179824,tanh,uniform,16,False,0.2,False,True,False,False,512.0,,0.002,,L2,True,False,False,False,True,5,RMSprop,max,2.0,0.0,0.2176165803108808,,,,PRUNED
41,0.4330751825552152,2025-09-12 04:28:22.256933,2025-09-12 04:32:56.874886,0 days 00:04:34.617953,elu,decreasing,16,False,0.4,True,True,False,,512.0,9.0,1e-05,,L2,True,True,False,,True,4,AdamW,max,,0.0,0.21875,0.352314335124133,,,COMPLETE
42,0.3989897917260771,2025-09-12 04:32:56.876888,2025-09-12 04:35:47.491422,0 days 00:02:50.614534,elu,decreasing,16,False,0.4,True,True,False,,512.0,7.0,1e-05,,L2,True,True,False,,True,4,AdamW,max,,0.0,0.3730560106370349,0.21875,0.2792594173008084,,COMPLETE
43,0.4141013186828988,2025-09-12 04:35:47.493423,2025-09-12 04:43:06.106402,0 days 00:07:18.612979,elu,decreasing,16,False,0.5,True,True,False,,512.0,9.0,1e-05,,L2,True,True,False,,True,4,AdamW,max,,0.0,0.3473165721222308,0.4073268921095008,0.3465572955505842,,COMPLETE
44,0.4361384068413557,2025-09-12 04:43:06.108369,2025-09-12 04:48:27.467089,0 days 00:05:21.358720,elu,decreasing,16,False,0.4,True,True,False,,512.0,9.0,1e-05,,L2,True,True,False,,True,4,AdamW,max,,0.0,0.21875,0.3498253386725738,,,COMPLETE
45,0.4069663908729937,2025-09-12 04:48:27.470089,2025-09-12 04:52:57.802554,0 days 00:04:30.332465,elu,decreasing,16,False,0.4,True,True,False,,512.0,9.0,1e-05,,L2,True,True,False,,True,4,AdamW,max,,0.0,0.3443757668356599,0.3683620568866471,0.21875,0.363514463640016,COMPLETE
46,0.178030303030303,2025-09-12 04:52:57.804555,2025-09-12 04:55:24.492499,0 days 00:02:26.687944,elu,decreasing,16,True,0.4,True,True,False,,512.0,8.0,1e-05,,L2,True,True,False,,True,4,AdamW,mean,,0.0,0.178030303030303,,,,PRUNED
47,0.4357029674140275,2025-09-12 04:55:24.494499,2025-09-12 05:01:29.164885,0 days 00:06:04.670386,leakyrelu,decreasing,16,False,0.3,True,True,False,False,768.0,9.0,1e-05,,L2,True,True,False,True,True,5,AdamW,max,,0.0,0.21875,0.3881360544217687,,,COMPLETE
48,0.3108412376976739,2025-09-12 05:01:29.166885,2025-09-12 05:03:16.497335,0 days 00:01:47.330450,leakyrelu,decreasing,64,False,0.3,True,True,False,False,768.0,8.0,0.0001,,L2,False,True,False,True,False,5,AdamW,max,,2e-07,0.21875,0.21875,0.2470698546647913,,COMPLETE
49,0.178030303030303,2025-09-12 05:03:16.499335,2025-09-12 05:05:58.850584,0 days 00:02:42.351249,leakyrelu,decreasing,16,True,0.3,True,False,False,False,768.0,9.0,1e-05,,L2,True,True,False,True,True,5,AdamW,mean,,0.0,0.3838612368024132,0.178030303030303,,,PRUNED
