number,value,datetime_start,datetime_complete,duration,params_activation,params_architecture_pattern,params_batch_size,params_bidirectional,params_dropout,params_dropout_layer_1,params_dropout_layer_2,params_dropout_layer_3,params_dropout_layer_4,params_fc_hidden,params_first_size_idx,params_lr,params_momentum_sgd,params_norm,params_norm_layer_1,params_norm_layer_2,params_norm_layer_3,params_norm_layer_4,params_norm_post_lstm,params_num_layers,params_optimizer,params_pooling,params_size_idx,params_weight_decay,system_attrs_completed_rung_0,system_attrs_completed_rung_1,system_attrs_completed_rung_2,system_attrs_completed_rung_3,state
0,0.3931797094739043,2025-09-12 05:34:13.700977,2025-09-12 05:35:15.721566,0 days 00:01:02.020589,,uniform,16,False,0.5,False,,,,,,0.001,,L2,True,,,,True,2,RMSprop,max,1.0,1e-05,0.21875,0.21875,0.3429102308273561,,COMPLETE
1,0.1904865572338284,2025-09-12 05:35:15.722566,2025-09-12 05:36:50.854130,0 days 00:01:35.131564,silu,decreasing,96,False,0.1,False,True,False,True,64.0,7.0,0.0001,0.3,minmax,False,False,True,False,False,5,SGD,last,,2e-07,0.178030303030303,0.2164048865619546,,,COMPLETE
2,0.178030303030303,2025-09-12 05:36:50.856131,2025-09-12 05:37:54.953429,0 days 00:01:04.097298,relu,decreasing,16,True,0.4,False,False,,,512.0,2.0,1e-05,,minmax,False,False,,,True,3,Adam,mean,,5e-07,0.2175438596491228,0.178030303030303,,,PRUNED
3,0.2175904889576118,2025-09-12 05:37:54.954429,2025-09-12 05:39:00.032970,0 days 00:01:05.078541,tanh,increasing,96,True,0.4,,,,,128.0,8.0,0.0002,,minmax,,,,,True,1,Adam,mean,,1e-06,0.2176165803108808,0.178030303030303,0.178030303030303,0.2164048865619546,COMPLETE
4,0.0855855855855855,2025-09-12 05:39:00.033970,2025-09-12 05:39:29.264883,0 days 00:00:29.230913,leakyrelu,uniform,128,False,0.3,True,False,,,768.0,,0.001,0.0,L2,False,False,,,True,3,SGD,last,7.0,2e-07,0.0855855855855855,,,,PRUNED
5,0.178030303030303,2025-09-12 05:39:29.265883,2025-09-12 05:41:02.498578,0 days 00:01:33.232695,gelu,increasing,128,True,0.0,False,False,True,False,128.0,4.0,2e-05,,minmax,True,False,False,True,True,5,AdamW,last,,1e-06,0.178030303030303,,,,PRUNED
6,0.178030303030303,2025-09-12 05:41:02.499578,2025-09-12 05:47:07.385245,0 days 00:06:04.885667,silu,uniform,16,True,0.5,True,,,,768.0,,0.0001,,L2,True,,,,True,2,AdamW,mean,9.0,2e-07,0.21875,0.21875,0.178030303030303,,PRUNED
7,0.3913725866771135,2025-09-12 05:47:07.386245,2025-09-12 05:48:33.603286,0 days 00:01:26.217041,,increasing,64,False,0.2,True,,,,,7.0,0.001,,L2,True,,,,False,2,AdamW,max,,2e-07,0.21875,0.2164048865619546,,,COMPLETE
8,0.1770244821092278,2025-09-12 05:48:33.605286,2025-09-12 05:48:37.921828,0 days 00:00:04.316542,relu,increasing,64,False,0.5,False,,,,64.0,0.0,5e-05,0.9,minmax,False,,,,False,2,SGD,max,,2e-06,0.1770244821092278,,,,PRUNED
9,0.2176165803108808,2025-09-12 05:48:37.922828,2025-09-12 05:49:45.804294,0 days 00:01:07.881466,silu,uniform,16,True,0.4,False,False,True,False,1024.0,,0.002,0.9,L2,True,True,False,False,True,5,SGD,mean,2.0,5e-07,0.2176165803108808,,,,PRUNED
10,0.0855855855855855,2025-09-12 05:49:45.806294,2025-09-12 05:49:54.013201,0 days 00:00:08.206907,,uniform,32,False,0.2,,,,,,,0.01,,L2,,,,,False,1,RMSprop,max,0.0,1e-05,0.0855855855855855,,,,PRUNED
11,0.2164048865619546,2025-09-12 05:49:54.014201,2025-09-12 05:50:49.776561,0 days 00:00:55.762360,,increasing,64,False,0.2,True,,,,,6.0,0.001,,L2,True,,,,False,2,RMSprop,max,,0.0,0.3046171171171171,0.21875,0.2164048865619546,,PRUNED
12,0.3835037032276216,2025-09-12 05:50:49.777562,2025-09-12 05:51:31.787030,0 days 00:00:42.009468,elu,uniform,64,False,0.1,True,,,,256.0,,0.001,,L2,True,,,,False,2,AdamW,max,4.0,1e-07,0.3185317245002541,0.178030303030303,0.178030303030303,0.3582887700534758,COMPLETE
13,0.178030303030303,2025-09-12 05:51:31.788030,2025-09-12 05:52:12.025016,0 days 00:00:40.236986,,increasing,32,False,0.3,True,True,False,,,4.0,0.001,,L2,True,True,True,,False,4,RMSprop,max,,1e-05,0.178030303030303,,,,PRUNED
14,0.4214926954942171,2025-09-12 05:52:12.027016,2025-09-12 05:53:09.546412,0 days 00:00:57.519396,,decreasing,64,False,0.1,,,,,,9.0,0.001,,L2,,,,,True,1,AdamW,max,,1e-05,0.21875,0.21875,0.2164048865619546,,COMPLETE
15,0.3961552756010872,2025-09-12 05:53:09.548412,2025-09-12 05:55:40.735580,0 days 00:02:31.187168,,decreasing,16,False,0.0,,,,,,9.0,0.002,,L2,,,,,True,1,RMSprop,max,,1e-05,0.2176165803108808,0.3028571428571429,0.21875,0.3960214927092332,COMPLETE
16,0.3382255856211951,2025-09-12 05:55:40.736581,2025-09-12 05:57:04.913827,0 days 00:01:24.177246,leakyrelu,decreasing,64,False,0.0,,,,,512.0,9.0,0.002,,L2,,,,,True,1,AdamW,max,,1e-05,0.21875,0.2805485113177421,,,COMPLETE
17,0.178030303030303,2025-09-12 05:57:04.915827,2025-09-12 05:57:50.359503,0 days 00:00:45.443676,gelu,decreasing,16,False,0.1,,,,,1024.0,9.0,0.002,,L2,,,,,True,1,RMSprop,max,,1e-05,0.178030303030303,,,,PRUNED
18,0.2164048865619546,2025-09-12 05:57:50.360504,2025-09-12 05:59:30.011922,0 days 00:01:39.651418,tanh,decreasing,128,False,0.0,False,True,True,,256.0,9.0,1e-05,,L2,False,True,False,,True,4,Adam,max,,1e-07,0.2176165803108808,0.178030303030303,0.178030303030303,0.2164048865619546,PRUNED
19,0.3803096035979187,2025-09-12 05:59:30.012922,2025-09-12 06:00:13.771893,0 days 00:00:43.758971,,decreasing,32,False,0.1,,,,,,6.0,2e-05,,L2,,,,,True,1,AdamW,last,,2e-06,0.378105852269986,0.2204639210116994,0.3064161722698308,,COMPLETE
20,0.178030303030303,2025-09-12 06:00:13.774894,2025-09-12 06:01:04.252957,0 days 00:00:50.478063,,decreasing,96,False,0.0,True,True,,,,8.0,0.0002,,L2,False,True,,,True,3,RMSprop,max,,0.0,0.2852635948526359,0.178030303030303,,,PRUNED
21,0.178030303030303,2025-09-12 06:01:04.253957,2025-09-12 06:01:37.421474,0 days 00:00:33.167517,,decreasing,16,False,0.1,,,,,,5.0,5e-05,,L2,,,,,True,1,RMSprop,max,,1e-05,0.3509856253219085,0.21875,0.21875,0.178030303030303,PRUNED
22,0.0855855855855855,2025-09-12 06:01:37.422474,2025-09-12 06:01:53.926443,0 days 00:00:16.503969,,uniform,16,False,0.0,False,,,,,,0.01,,L2,True,,,,True,2,RMSprop,max,0.0,1e-05,0.0855855855855855,,,,PRUNED
23,0.4079168266146019,2025-09-12 06:01:53.927444,2025-09-12 06:02:27.945337,0 days 00:00:34.017893,,decreasing,16,False,0.3,,,,,,2.0,0.002,,L2,,,,,True,1,RMSprop,max,,1e-05,0.21875,0.364657824933687,,,COMPLETE
24,0.3825260097527305,2025-09-12 06:02:27.947337,2025-09-12 06:03:07.209040,0 days 00:00:39.261703,,decreasing,16,False,0.3,,,,,,2.0,0.002,,L2,,,,,True,1,RMSprop,max,,1e-05,0.3458750009667664,0.21875,0.21875,0.2164048865619546,COMPLETE
25,0.4014839166265739,2025-09-12 06:03:07.211040,2025-09-12 06:03:26.513887,0 days 00:00:19.302847,,decreasing,64,False,0.2,,,,,,2.0,0.002,,L2,,,,,True,1,RMSprop,max,,1e-05,0.21875,0.21875,0.3215235519495154,,COMPLETE
26,0.178030303030303,2025-09-12 06:03:26.515888,2025-09-12 06:03:33.212840,0 days 00:00:06.696952,elu,decreasing,64,True,0.2,,,,,64.0,2.0,0.002,,minmax,,,,,True,1,AdamW,max,,1e-05,0.178030303030303,,,,PRUNED
27,0.2164048865619546,2025-09-12 06:03:33.213840,2025-09-12 06:04:09.233792,0 days 00:00:36.019952,tanh,decreasing,64,False,0.3,True,True,False,,256.0,4.0,0.002,,L2,False,False,True,,True,4,Adam,max,,1e-05,0.21875,0.21875,0.2164048865619546,,PRUNED
28,0.0855855855855855,2025-09-12 06:04:09.235793,2025-09-12 06:04:16.453061,0 days 00:00:07.217268,elu,decreasing,64,False,0.2,True,,,,512.0,1.0,0.002,,L2,False,,,,True,2,RMSprop,mean,,1e-06,0.0855855855855855,,,,PRUNED
29,0.347464794135077,2025-09-12 06:04:16.454061,2025-09-12 06:04:52.424009,0 days 00:00:35.969948,,decreasing,64,False,0.3,False,False,,,,3.0,1e-05,,L2,False,True,,,True,3,RMSprop,last,,1e-05,0.21875,0.236068376068376,,,COMPLETE
30,0.3653291093543926,2025-09-12 06:04:52.426009,2025-09-12 06:05:09.432486,0 days 00:00:17.006477,leakyrelu,decreasing,64,False,0.2,,,,,128.0,0.0,0.0002,,L2,,,,,True,1,AdamW,max,,0.0,0.347363184079602,0.2537597563297163,0.2164048865619546,,COMPLETE
31,0.3991629126161333,2025-09-12 06:05:09.434486,2025-09-12 06:05:55.154699,0 days 00:00:45.720213,,decreasing,16,False,0.1,,,,,,3.0,0.002,,L2,,,,,True,1,RMSprop,max,,1e-05,0.3800860452289023,0.21875,0.3774922918807811,,COMPLETE
32,0.178030303030303,2025-09-12 06:05:55.156700,2025-09-12 06:06:11.820254,0 days 00:00:16.663554,,decreasing,16,False,0.1,,,,,,3.0,0.002,,L2,,,,,True,1,RMSprop,max,,1e-05,0.3263613231552162,0.3343399859943978,0.178030303030303,,PRUNED
33,0.4556880325638848,2025-09-12 06:06:11.821254,2025-09-12 06:06:44.512284,0 days 00:00:32.691030,,decreasing,96,False,0.1,True,,,,,3.0,0.0001,,L2,False,,,,True,2,RMSprop,max,,5e-07,0.21875,0.3289285714285714,,,COMPLETE
34,0.2164048865619546,2025-09-12 06:06:44.514285,2025-09-12 06:07:04.193726,0 days 00:00:19.679441,gelu,decreasing,96,False,0.1,True,,,,1024.0,2.0,0.0001,,minmax,False,,,,True,2,RMSprop,max,,5e-07,0.3494623655913978,0.2164048865619546,,,PRUNED
35,0.178030303030303,2025-09-12 06:07:04.195726,2025-09-12 06:07:25.578538,0 days 00:00:21.382812,relu,decreasing,96,True,0.2,True,,,,768.0,3.0,0.0001,0.5,L2,False,,,,True,2,SGD,last,,5e-07,0.21875,0.178030303030303,,,PRUNED
36,0.2176165803108808,2025-09-12 06:07:25.579538,2025-09-12 06:07:28.306162,0 days 00:00:02.726624,,decreasing,96,False,0.4,,,,,,1.0,0.0001,,minmax,,,,,True,1,Adam,mean,,5e-07,0.2176165803108808,,,,PRUNED
37,0.46575110694052,2025-09-12 06:07:28.307162,2025-09-12 06:09:10.564413,0 days 00:01:42.257251,gelu,decreasing,96,True,0.4,True,,,,128.0,5.0,0.0001,,L2,False,,,,True,2,RMSprop,max,,5e-07,0.21875,0.4189208405074567,,,COMPLETE
38,0.4783558374699979,2025-09-12 06:09:10.566414,2025-09-12 06:12:01.783506,0 days 00:02:51.217092,gelu,decreasing,96,True,0.4,True,False,,,128.0,5.0,0.0001,,minmax,False,False,,,True,3,AdamW,last,,5e-07,0.3473165721222308,0.21875,0.3966346153846154,,COMPLETE
39,0.4662970720015063,2025-09-12 06:12:01.785506,2025-09-12 06:14:18.550404,0 days 00:02:16.764898,gelu,decreasing,96,True,0.5,True,False,,,128.0,5.0,0.0001,,minmax,False,False,,,True,3,AdamW,last,,5e-07,0.385372406675919,0.21875,0.3726304137263041,,COMPLETE
40,0.178030303030303,2025-09-12 06:14:18.552404,2025-09-12 06:15:10.612422,0 days 00:00:52.060018,gelu,increasing,96,True,0.5,True,False,,,128.0,5.0,0.0001,,minmax,False,False,,,False,3,AdamW,last,,5e-07,0.178030303030303,,,,PRUNED
41,0.4319683108429492,2025-09-12 06:15:10.613422,2025-09-12 06:17:17.814980,0 days 00:02:07.201558,gelu,decreasing,96,True,0.4,True,False,,,128.0,5.0,0.0001,,minmax,False,False,,,True,3,AdamW,last,,5e-07,0.21875,0.3586885927311459,,,COMPLETE
42,0.4705310455779792,2025-09-12 06:17:17.816981,2025-09-12 06:19:48.949393,0 days 00:02:31.132412,gelu,decreasing,96,True,0.4,True,False,,,128.0,5.0,0.0001,,minmax,False,False,,,True,3,AdamW,last,,5e-07,0.21875,0.3846649804096612,,,COMPLETE
43,0.4654299179359945,2025-09-12 06:19:48.951395,2025-09-12 06:22:52.636260,0 days 00:03:03.684865,gelu,decreasing,96,True,0.4,True,False,,,128.0,6.0,0.0001,,minmax,False,False,,,True,3,AdamW,last,,5e-07,0.21875,0.4459808259587021,,,COMPLETE
44,0.4546965604039454,2025-09-12 06:22:52.639262,2025-09-12 06:25:48.843116,0 days 00:02:56.203854,gelu,decreasing,96,True,0.4,True,False,,,128.0,6.0,0.0001,,minmax,False,False,,,True,3,AdamW,last,,5e-07,0.2176165803108808,0.4059063110288827,0.21875,0.3592073515067508,COMPLETE
45,0.4535350610943058,2025-09-12 06:25:48.846117,2025-09-12 06:28:17.813748,0 days 00:02:28.967631,gelu,decreasing,96,True,0.5,True,False,False,,128.0,5.0,0.0001,,minmax,False,False,False,,True,4,AdamW,last,,5e-07,0.3619846261355695,0.21875,0.392266586005243,,COMPLETE
46,0.2164048865619546,2025-09-12 06:28:17.815748,2025-09-12 06:29:35.942868,0 days 00:01:18.127120,gelu,uniform,96,True,0.4,True,False,,,128.0,,0.0001,,minmax,False,False,,,False,3,AdamW,last,5.0,5e-07,0.21875,0.21875,0.2164048865619546,,PRUNED
47,0.178030303030303,2025-09-12 06:29:35.943868,2025-09-12 06:31:03.442183,0 days 00:01:27.498315,gelu,increasing,96,True,0.5,True,False,True,,128.0,5.0,0.0001,,minmax,False,False,True,,True,4,AdamW,last,,5e-07,0.178030303030303,,,,PRUNED
48,0.4682411510418178,2025-09-12 06:31:03.444184,2025-09-12 06:35:25.287796,0 days 00:04:21.843612,gelu,decreasing,96,True,0.4,True,False,,,128.0,7.0,0.0001,,minmax,False,False,,,True,3,AdamW,last,,5e-07,0.3744271655022162,0.3898867239203373,0.21875,0.3242529026454134,COMPLETE
49,0.178030303030303,2025-09-12 06:35:25.289796,2025-09-12 06:37:24.852639,0 days 00:01:59.562843,gelu,uniform,128,True,0.5,True,False,,,128.0,,2e-05,,minmax,False,False,,,False,3,AdamW,last,9.0,5e-07,0.178030303030303,,,,PRUNED
