number,value,datetime_start,datetime_complete,duration,params_activation,params_architecture_pattern,params_batch_size,params_bidirectional,params_dropout,params_dropout_layer_1,params_dropout_layer_2,params_dropout_layer_3,params_dropout_layer_4,params_fc_hidden,params_first_size_idx,params_lr,params_momentum_sgd,params_norm,params_norm_layer_1,params_norm_layer_2,params_norm_layer_3,params_norm_layer_4,params_norm_post_lstm,params_num_layers,params_optimizer,params_pooling,params_size_idx,params_weight_decay,system_attrs_completed_rung_0,system_attrs_completed_rung_1,system_attrs_completed_rung_2,system_attrs_completed_rung_3,system_attrs_completed_rung_4,state
0,0.3997752716058707,2025-09-12 09:39:05.184172,2025-09-12 09:39:50.370917,0 days 00:00:45.186745,,uniform,16,False,0.5,False,,,,,,0.001,,L2,True,,,,True,2,RMSprop,max,1.0,1e-05,0.3800995075807987,0.21875,0.4262049118837086,,,COMPLETE
1,0.1596716514189227,2025-09-12 09:39:50.372917,2025-09-12 09:40:22.003475,0 days 00:00:31.630558,silu,decreasing,96,False,0.1,False,True,False,True,64.0,7.0,0.0001,0.3,minmax,False,False,True,False,False,5,SGD,last,,2e-07,0.0855855855855855,0.2164048865619546,,,,COMPLETE
2,0.2175904889576118,2025-09-12 09:40:22.005476,2025-09-12 09:41:17.320804,0 days 00:00:55.315328,relu,decreasing,16,True,0.4,False,False,,,512.0,2.0,1e-05,,minmax,False,False,,,True,3,Adam,mean,,5e-07,0.2176165803108808,0.21875,0.21875,0.2164048865619546,,COMPLETE
3,0.2175904889576118,2025-09-12 09:41:17.322803,2025-09-12 09:41:39.970641,0 days 00:00:22.647838,tanh,increasing,96,True,0.4,,,,,128.0,8.0,0.0002,,minmax,,,,,True,1,Adam,mean,,1e-06,0.2176165803108808,0.21875,0.21875,0.2164048865619546,,COMPLETE
4,0.178030303030303,2025-09-12 09:41:39.972642,2025-09-12 09:41:49.723906,0 days 00:00:09.751264,leakyrelu,uniform,128,False,0.3,True,False,,,768.0,,0.001,0.0,L2,False,False,,,True,3,SGD,last,7.0,2e-07,0.178030303030303,,,,,PRUNED
5,0.2175904889576118,2025-09-12 09:41:49.724907,2025-09-12 09:43:12.894080,0 days 00:01:23.169173,gelu,increasing,128,True,0.0,False,False,True,False,128.0,4.0,2e-05,,minmax,True,False,False,True,True,5,AdamW,last,,1e-06,0.2176165803108808,0.21875,0.21875,0.2164048865619546,,COMPLETE
6,0.3473801991515531,2025-09-12 09:43:12.896080,2025-09-12 09:46:07.245462,0 days 00:02:54.349382,silu,uniform,16,True,0.5,True,,,,768.0,,0.0001,,L2,True,,,,True,2,AdamW,mean,9.0,2e-07,0.4069960775130261,0.21875,0.3473801991515531,,,PRUNED
7,0.178030303030303,2025-09-12 09:46:07.246463,2025-09-12 09:46:28.499085,0 days 00:00:21.252622,,increasing,64,False,0.2,True,,,,,7.0,0.001,,L2,True,,,,False,2,AdamW,max,,2e-07,0.2176165803108808,0.21875,0.21875,0.178030303030303,,PRUNED
8,0.0894854586129754,2025-09-12 09:46:28.501085,2025-09-12 09:46:37.090564,0 days 00:00:08.589479,relu,increasing,64,False,0.5,False,,,,64.0,0.0,5e-05,0.9,minmax,False,,,,False,2,SGD,max,,2e-06,0.178030303030303,0.0894854586129754,,,,PRUNED
9,0.2540466200358359,2025-09-12 09:46:37.091564,2025-09-12 09:48:14.962592,0 days 00:01:37.871028,silu,uniform,16,True,0.4,False,False,True,False,1024.0,,0.002,0.9,L2,True,True,False,False,True,5,SGD,mean,2.0,5e-07,0.178030303030303,0.21875,,,,COMPLETE
10,0.0855855855855855,2025-09-12 09:48:14.964593,2025-09-12 09:48:23.546353,0 days 00:00:08.581760,,uniform,32,False,0.2,,,,,,,0.01,,L2,,,,,False,1,RMSprop,max,0.0,1e-05,0.0855855855855855,,,,,PRUNED
11,0.0888888888888888,2025-09-12 09:48:23.547353,2025-09-12 09:48:38.850528,0 days 00:00:15.303175,elu,uniform,16,True,0.4,False,True,True,,1024.0,,0.002,,L2,True,True,False,,True,4,RMSprop,mean,1.0,5e-07,0.0888888888888888,,,,,PRUNED
12,0.178030303030303,2025-09-12 09:48:38.851528,2025-09-12 09:48:59.483129,0 days 00:00:20.631601,silu,uniform,16,False,0.5,False,False,True,,256.0,,0.002,,L2,True,True,False,,True,4,RMSprop,max,3.0,1e-07,0.178030303030303,,,,,PRUNED
13,0.0894854586129754,2025-09-12 09:48:59.485130,2025-09-12 09:49:57.116312,0 days 00:00:57.631182,gelu,uniform,16,True,0.3,False,False,False,,1024.0,,0.002,,L2,True,True,True,,True,4,RMSprop,max,3.0,1e-05,0.21875,0.0894854586129754,,,,PRUNED
14,0.3439301349822112,2025-09-12 09:49:57.117312,2025-09-12 09:50:29.586393,0 days 00:00:32.469081,leakyrelu,uniform,32,True,0.4,False,,,,1024.0,,0.001,0.9,L2,True,,,,True,2,SGD,mean,2.0,0.0,0.2176165803108808,0.2954545454545454,0.2566652659102582,0.21875,,COMPLETE
15,0.0855855855855855,2025-09-12 09:50:29.588394,2025-09-12 09:50:39.041984,0 days 00:00:09.453590,,uniform,32,False,0.5,False,,,,,,0.001,0.6000000000000001,L2,True,,,,True,2,SGD,mean,5.0,0.0,0.2176165803108808,0.0855855855855855,,,,PRUNED
16,0.21875,2025-09-12 09:50:39.042983,2025-09-12 09:50:44.596234,0 days 00:00:05.553251,leakyrelu,decreasing,32,False,0.3,,,,,256.0,4.0,0.001,,L2,,,,,True,1,RMSprop,max,,0.0,0.21875,,,,,PRUNED
17,0.3465086401641054,2025-09-12 09:50:44.597234,2025-09-12 09:51:22.733681,0 days 00:00:38.136447,leakyrelu,uniform,32,True,0.4,True,True,,,512.0,,0.001,,L2,True,False,,,True,3,Adam,mean,0.0,1e-05,0.2176165803108808,0.21875,0.21875,0.2164048865619546,,COMPLETE
18,0.2175904889576118,2025-09-12 09:51:22.735682,2025-09-12 09:51:47.967905,0 days 00:00:25.232223,tanh,uniform,32,False,0.5,True,True,,,512.0,,0.0002,,L2,True,False,,,False,3,Adam,max,0.0,1e-05,0.2176165803108808,0.21875,0.21875,0.2164048865619546,,COMPLETE
19,0.178030303030303,2025-09-12 09:51:47.969906,2025-09-12 09:53:32.954238,0 days 00:01:44.984332,elu,decreasing,64,True,0.3,True,True,,,512.0,9.0,5e-05,,L2,True,False,,,True,3,Adam,last,,1e-05,0.21875,0.178030303030303,,,,PRUNED
20,0.2175904889576118,2025-09-12 09:53:32.955238,2025-09-12 09:53:53.683016,0 days 00:00:20.727778,,uniform,96,False,0.4,True,True,,,,,1e-05,,L2,True,False,,,True,3,Adam,mean,5.0,1e-05,0.21875,0.2164048865619546,,,,COMPLETE
21,0.2175904889576118,2025-09-12 09:53:53.685017,2025-09-12 09:54:19.385575,0 days 00:00:25.700558,leakyrelu,uniform,32,True,0.4,True,,,,1024.0,,0.001,,L2,True,,,,True,2,RMSprop,mean,2.0,0.0,0.2176165803108808,0.21875,0.21875,0.2164048865619546,,COMPLETE
22,0.2164048865619546,2025-09-12 09:54:19.386575,2025-09-12 09:54:34.280469,0 days 00:00:14.893894,leakyrelu,uniform,32,True,0.5,False,,,,512.0,,0.001,0.6000000000000001,L2,True,,,,True,2,SGD,mean,0.0,2e-06,0.21875,0.21875,0.2164048865619546,,,PRUNED
23,0.2164048865619546,2025-09-12 09:54:34.281469,2025-09-12 09:54:47.620491,0 days 00:00:13.339022,leakyrelu,uniform,32,True,0.4,,,,,512.0,,0.001,,L2,,,,,True,1,Adam,mean,2.0,1e-07,0.3520414226296579,0.21875,0.2164048865619546,,,PRUNED
24,0.178030303030303,2025-09-12 09:54:47.621491,2025-09-12 09:54:55.929361,0 days 00:00:08.307870,leakyrelu,uniform,32,True,0.2,False,,,,1024.0,,0.01,,L2,True,,,,True,2,RMSprop,mean,1.0,0.0,0.2176165803108808,0.178030303030303,,,,PRUNED
25,0.3431701258815395,2025-09-12 09:54:55.930361,2025-09-12 09:55:46.080549,0 days 00:00:50.150188,,uniform,128,True,0.3,True,True,,,,,2e-05,,L2,True,False,,,True,3,Adam,max,4.0,1e-05,0.21875,0.21875,,,,COMPLETE
26,0.2164048865619546,2025-09-12 09:55:46.081549,2025-09-12 09:56:12.132041,0 days 00:00:26.050492,leakyrelu,uniform,32,True,0.5,False,True,False,,256.0,,0.001,0.3,minmax,False,True,True,,False,4,SGD,mean,1.0,1e-05,0.21875,0.21875,0.2164048865619546,,,PRUNED
27,0.2175904889576118,2025-09-12 09:56:12.133041,2025-09-12 09:56:40.683064,0 days 00:00:28.550023,leakyrelu,uniform,32,True,0.4,True,,,,64.0,,0.001,,L2,True,,,,True,2,AdamW,mean,3.0,0.0,0.2176165803108808,0.21875,0.21875,0.2314327485380116,,COMPLETE
28,0.402231023158714,2025-09-12 09:56:40.685065,2025-09-12 09:57:05.716106,0 days 00:00:25.031041,gelu,decreasing,16,False,0.1,,,,,128.0,0.0,0.001,,L2,,,,,True,1,Adam,last,,1e-05,0.21875,0.21875,0.3722588522588523,,,COMPLETE
29,0.2175904889576118,2025-09-12 09:57:05.718106,2025-09-12 09:57:26.497890,0 days 00:00:20.779784,gelu,decreasing,16,False,0.0,,,,,128.0,0.0,0.0001,,minmax,,,,,False,1,Adam,last,,1e-05,0.2176165803108808,0.21875,0.21875,0.2164048865619546,,COMPLETE
30,0.2164048865619546,2025-09-12 09:57:26.499891,2025-09-12 09:57:42.932789,0 days 00:00:16.432898,gelu,decreasing,16,False,0.1,,,,,128.0,2.0,0.001,,L2,,,,,True,1,Adam,last,,1e-05,0.21875,0.21875,0.2164048865619546,,,PRUNED
31,0.4256248431815344,2025-09-12 09:57:42.933789,2025-09-12 09:57:51.761389,0 days 00:00:08.827600,gelu,decreasing,96,False,0.1,,,,,128.0,2.0,0.001,,L2,,,,,True,1,Adam,last,,1e-05,0.21875,0.21875,0.3844746303079636,,,COMPLETE
32,0.178030303030303,2025-09-12 09:57:51.763390,2025-09-12 09:57:54.705059,0 days 00:00:02.941669,gelu,decreasing,96,False,0.1,,,,,128.0,2.0,1e-05,,L2,,,,,True,1,Adam,last,,1e-05,0.178030303030303,,,,,PRUNED
33,0.4305714503005161,2025-09-12 09:57:54.706060,2025-09-12 09:58:03.490614,0 days 00:00:08.784554,gelu,decreasing,96,False,0.1,,,,,128.0,1.0,0.001,,L2,,,,,True,1,Adam,last,,1e-05,0.3162142901406705,0.21875,0.21875,0.3930862483448391,,COMPLETE
34,0.4426118613114947,2025-09-12 09:58:03.492615,2025-09-12 09:58:17.412310,0 days 00:00:13.919695,gelu,decreasing,96,False,0.1,,,,,128.0,1.0,0.0002,,minmax,,,,,True,1,Adam,last,,1e-06,0.2176165803108808,0.3010882303699983,0.21875,0.3566956359218765,0.4549587951122478,COMPLETE
35,0.4390299716900074,2025-09-12 09:58:17.414310,2025-09-12 09:58:32.472998,0 days 00:00:15.058688,gelu,decreasing,96,False,0.1,,,,,128.0,1.0,0.0002,,minmax,,,,,True,1,Adam,last,,1e-06,0.327405760859498,0.3148148148148148,0.21875,0.2816205533596838,,COMPLETE
36,0.4376364163023673,2025-09-12 09:58:32.474999,2025-09-12 09:58:46.639186,0 days 00:00:14.164187,gelu,decreasing,96,False,0.0,,,,,128.0,2.0,0.0002,,minmax,,,,,True,1,Adam,last,,1e-06,0.3526881720430108,0.21875,0.3727719298245613,,,COMPLETE
37,0.3082558467173852,2025-09-12 09:58:46.641187,2025-09-12 09:58:52.239631,0 days 00:00:05.598444,gelu,decreasing,96,False,0.0,,,,,128.0,1.0,0.0002,,minmax,,,,,True,1,Adam,last,,1e-06,0.21875,0.21875,0.3082558467173852,,,PRUNED
38,0.3953410910774323,2025-09-12 09:58:52.240631,2025-09-12 09:59:02.743935,0 days 00:00:10.503304,gelu,decreasing,96,False,0.0,,,,,128.0,1.0,0.0002,,minmax,,,,,True,1,Adam,last,,1e-06,0.3208874458874459,0.21875,0.3999011247064639,,,COMPLETE
39,0.431398769909671,2025-09-12 09:59:02.745937,2025-09-12 09:59:14.419577,0 days 00:00:11.673640,gelu,decreasing,96,False,0.0,,,,,128.0,3.0,0.0002,,minmax,,,,,True,1,Adam,last,,1e-06,0.2282394439257184,0.30566534914361,0.21875,0.2856540084388185,,COMPLETE
40,0.3082558467173852,2025-09-12 09:59:14.421577,2025-09-12 09:59:25.446022,0 days 00:00:11.024445,relu,decreasing,96,False,0.0,,,,,768.0,3.0,0.0002,,minmax,,,,,False,1,Adam,last,,1e-06,0.314941944232562,0.4698634698634699,0.3082558467173852,,,PRUNED
41,0.4393757736516357,2025-09-12 09:59:25.447022,2025-09-12 09:59:40.130788,0 days 00:00:14.683766,gelu,decreasing,96,False,0.1,,,,,128.0,1.0,0.0002,,minmax,,,,,True,1,Adam,last,,1e-06,0.2176165803108808,0.3296385809928605,0.21875,0.3946236559139784,0.4393757736516357,PRUNED
42,0.4498620775780785,2025-09-12 09:59:40.132787,2025-09-12 09:59:54.784880,0 days 00:00:14.652093,gelu,decreasing,96,False,0.0,,,,,128.0,3.0,0.0002,,minmax,,,,,True,1,Adam,last,,1e-06,0.3147392290249433,0.21875,0.3479771257549036,,,COMPLETE
43,0.4513057490333103,2025-09-12 09:59:54.786881,2025-09-12 10:00:07.586401,0 days 00:00:12.799520,gelu,decreasing,96,False,0.0,,,,,128.0,3.0,0.0002,,minmax,,,,,True,1,Adam,last,,1e-06,0.3851673851673852,0.21875,0.3732537907034551,,,COMPLETE
44,0.3286177424108458,2025-09-12 10:00:07.587401,2025-09-12 10:00:20.226487,0 days 00:00:12.639086,tanh,increasing,96,False,0.0,True,,,,128.0,3.0,0.0002,,minmax,False,,,,True,2,AdamW,last,,1e-06,0.3675645342312009,0.21875,0.3286177424108458,,,PRUNED
45,0.4413286016992626,2025-09-12 10:00:20.227488,2025-09-12 10:00:37.439092,0 days 00:00:17.211604,gelu,decreasing,96,False,0.0,,,,,128.0,5.0,0.0002,,minmax,,,,,True,1,Adam,last,,1e-06,0.2176165803108808,0.2918518518518518,0.21875,0.427133655394525,,COMPLETE
46,0.4213048677096658,2025-09-12 10:00:37.441092,2025-09-12 10:00:53.596145,0 days 00:00:16.155053,gelu,decreasing,96,False,0.2,,,,,128.0,5.0,0.0002,,minmax,,,,,True,1,Adam,last,,1e-06,0.21875,0.2164048865619546,,,,COMPLETE
47,0.4396865122381411,2025-09-12 10:00:53.597145,2025-09-12 10:01:07.502093,0 days 00:00:13.904948,gelu,decreasing,96,False,0.1,,,,,768.0,5.0,0.0002,,minmax,,,,,True,1,Adam,last,,1e-06,0.4102984726438463,0.21875,0.4072010925997865,,,COMPLETE
48,0.21875,2025-09-12 10:01:07.504095,2025-09-12 10:01:13.114929,0 days 00:00:05.610834,relu,increasing,128,False,0.0,True,,,,768.0,5.0,0.0002,,minmax,False,,,,False,2,AdamW,last,,1e-06,0.21875,,,,,PRUNED
49,0.2851282051282051,2025-09-12 10:01:13.115930,2025-09-12 10:01:19.211894,0 days 00:00:06.095964,elu,decreasing,96,False,0.1,True,,,,768.0,5.0,0.0002,,minmax,False,,,,True,2,Adam,last,,2e-07,0.2851282051282051,,,,,PRUNED
